comentario,calificacion,marca,modelo
Si corresponde a la foto tiene un excelente rendimiento y capacidad su dise침o es novedoso Ya lleg칩 el domicilio del celular,5,Xiaomi,Xiaomi Poco X6 Pro 5G 512Gb 12Ram 64Mp
El tama침o es el apropiado y para cargar f치cilmente; la calidad de im치gen es optima causada por sus excelentes camaras de gran nitidez que facilita mi labor. La rapidez de subida y bajada de im치genes n칤tidas es notable gracias a su capacidad interna.,5,Xiaomi,Xiaomi Poco X6 Pro 5G 512Gb 12Ram 64Mp
Excelente tel칠fono con su funda cargador un tel칠fono muy bueno fluido y econ칩mico para tener ese procesador y ram lo 칰nico que falta es comprar el adaptador al cargador pero no es gran cosa recomendado comprar por l칤nea,5,Xiaomi,Xiaomi Poco X6 Pro 5G 512Gb 12Ram 64Mp
"El producto es excelente, llega con su respectivo estuche y cargador el cual es rapid칤simo, el celular a la mano es como un gama alta y su procesador es de lo mejor que hay.",5,Xiaomi,Xiaomi Poco X6 Pro 5G 512Gb 12Ram 64Mp
Cumplio con mis expectativas. Igual que la foto,5,Xiaomi,Xiaomi Poco X6 Pro 5G 512Gb 12Ram 64Mp
"Es excelente, es igual al de la foto y porsupuesto que es de gran calidad, lleg칩 antes de lo esperado.",5,Xiaomi,Xiaomi Poco X6 Pro 5G 512Gb 12Ram 64Mp
"El producto es excelente, llega con su respectivo estuche y cargador el cual es rapid칤simo, el celular a la mano es como un gama alta y su procesador es de lo mejor que hay.",5,Xiaomi,Xiaomi Poco X6 Pro 5G 512Gb 12Ram 64Mp
Cumplio con mis expectativas. Igual que la foto,5,Xiaomi,Xiaomi Poco X6 Pro 5G 512Gb 12Ram 64Mp
"Es excelente, es igual al de la foto y porsupuesto que es de gran calidad, lleg칩 antes de lo esperado.",5,Xiaomi,Xiaomi Poco X6 Pro 5G 512Gb 12Ram 64Mp
Muy bien,5,Xiaomi,Xiaomi Poco X6 Pro 5G 512Gb 12Ram 64Mp
Excelente calidad. Procesador potente que permite que el celular vuele!,5,Xiaomi,Xiaomi Poco X6 Pro 5G 512Gb 12Ram 64Mp
"Buena calidad, buen tiempo de env칤o y todo bien sellado",5,Xiaomi,Xiaomi Poco X6 Pro 5G 512Gb 12Ram 64Mp
Muy buena calidad y r치pido,5,Xiaomi,Xiaomi Poco X6 Pro 5G 512Gb 12Ram 64Mp
Cumple con las expectativas,5,Xiaomi,Xiaomi Poco X6 Pro 5G 512Gb 12Ram 64Mp
El tel칠fono es de muy buena calidad por su precio y lo que ofrece,5,Xiaomi,Xiaomi Poco X6 Pro 5G 512Gb 12Ram 64Mp
"Es igual al de la p치gina, 100% seguro la compra, excelente calidad del producto",5,Xiaomi,Xiaomi Poco X6 Pro 5G 512Gb 12Ram 64Mp
"Es unos de los mejores terminales de esta marca, muy recomendable",5,Xiaomi,Xiaomi Poco X6 Pro 5G 512Gb 12Ram 64Mp
Producto original y entrega r치pido,5,Xiaomi,Xiaomi Poco X6 Pro 5G 512Gb 12Ram 64Mp
"Buen producto, un poquito grandes, parece de buena calidad",4,Xiaomi,Xiaomi Poco X6 Pro 5G 512Gb 12Ram 64Mp
Exelente calidad,4,Xiaomi,Xiaomi Poco X6 Pro 5G 512Gb 12Ram 64Mp
"El tel칠fono es muy bueno comparado con el precio, lo que me parece muy malo es la garant칤a que da est치 tienda que es solo de 1 mes, en otras tiendan te dan 6 meses o 1 a침o de garant칤a, me di cuenta despu칠s de varios d칤as, pero si pueden escoger otra tienda con mejor garant칤a ser칤a mejor opci칩n",3,Xiaomi,Xiaomi Poco X6 Pro 5G 512Gb 12Ram 64Mp
"El equipo me salio da침ado, lo encend칤, inicie la configuraci칩n y los colores de la pantalla se ve칤an da침ados. Espero que la garant칤a responda y pueda tener un equipo nuevo u otro",1,Xiaomi,Xiaomi Poco X6 Pro 5G 512Gb 12Ram 64Mp
Me gust칩,5,Xiaomi,Xiaomi Poco X6 Pro 5G 512Gb 12Ram 64Mp
Es id칠ntico al d3 la foto y funciona super bien,5,Xiaomi,Xiaomi Poco X6 Pro 5G 512Gb 12Ram 64Mp
Est치 bien en todos los sentidos,5,Xiaomi,Xiaomi Poco X6 Pro 5G 512Gb 12Ram 64Mp
Totalmente id칠ntico,5,Xiaomi,Xiaomi Poco X6 Pro 5G 512Gb 12Ram 64Mp
Todo excelente,5,Xiaomi,Xiaomi Poco X6 Pro 5G 512Gb 12Ram 64Mp
Est치 bien en todos los sentidos,5,Xiaomi,Xiaomi Poco X6 Pro 5G 512Gb 12Ram 64Mp
Totalmente id칠ntico,5,Xiaomi,Xiaomi Poco X6 Pro 5G 512Gb 12Ram 64Mp
Todo excelente,5,Xiaomi,Xiaomi Poco X6 Pro 5G 512Gb 12Ram 64Mp
Corresponde a lo especificado en el anuncio,5,Xiaomi,Xiaomi Poco X6 Pro 5G 512Gb 12Ram 64Mp
"Excelente, funcionalidad y velocidad",5,Xiaomi,Xiaomi Poco X6 Pro 5G 512Gb 12Ram 64Mp
"Buena calidad, el tama침o corresponde y es igual a la foto",5,Xiaomi,Xiaomi Poco X6 Pro 5G 512Gb 12Ram 64Mp
"Perfecto el dispositivo, cumple con todas las caracter칤sticas",5,Xiaomi,Xiaomi Poco X6 Pro 5G 512Gb 12Ram 64Mp
Todo perfecto tama침o calidad,5,Xiaomi,Xiaomi Poco X6 Pro 5G 512Gb 12Ram 64Mp
Simplemente perfecto,5,Xiaomi,Xiaomi Poco X6 Pro 5G 512Gb 12Ram 64Mp
"Es justo lo que comore, lleg칩 en el tiempo acordado de entrega, sellado y en perfecto estado.",5,Xiaomi,Xiaomi Poco X6 Pro 5G 512Gb 12Ram 64Mp
"Es un producto muy bueno, pero no perfecto, a la hora de jugar con el la bater칤a no dura tanto como me gustar칤a y dos veces me saco de partidas online lo cual frustra un poco, pero la pantalla me a sorprendido de m치s pues puede correr videos a 4k no de la mejor manera pero si puede con respecto a todo lo de m치s a cumplido mis expectativas",4,Xiaomi,Xiaomi Poco X6 Pro 5G 512Gb 12Ram 64Mp
El pedido lleg칩 r치pidamente en buenas condiciones,4,Xiaomi,Xiaomi Poco X6 Pro 5G 512Gb 12Ram 64Mp
"El producto llego r치pido, se ve de buena calidad aunque no se ha estrenado pero a la fecha despu칠s de dos d칤as no han entregado la factura y no contestan por ning칰n medio (whatsapp, correo ni llamadas), esperemos a ver que pasa",2,Xiaomi,Xiaomi Poco X6 Pro 5G 512Gb 12Ram 64Mp
Hasta ahora ha salido de buena calidad actualizado,5,Xiaomi,Xiaomi Poco X6 Pro 5G 512Gb 12Ram 64Mp
"Me gusto mucho, y fue r치pido la llegada",5,Xiaomi,Xiaomi Poco X6 Pro 5G 512Gb 12Ram 64Mp
"Cumple lo que promete, es un lindo celular",5,Xiaomi,Xiaomi Poco X6 Pro 5G 512Gb 12Ram 64Mp
"Si es igual a la foto, me gust칩 el producto y lleg칩 en el tiempo estipulado",5,Xiaomi,Xiaomi Poco X6 Pro 5G 512Gb 12Ram 64Mp
"Muy buen producto Calidad-Precio, excelente rendimiento.",5,Xiaomi,Xiaomi Poco X6 Pro 5G 512Gb 12Ram 64Mp
"Cumple lo que promete, es un lindo celular",5,Xiaomi,Xiaomi Poco X6 Pro 5G 512Gb 12Ram 64Mp
"Si es igual a la foto, me gust칩 el producto y lleg칩 en el tiempo estipulado",5,Xiaomi,Xiaomi Poco X6 Pro 5G 512Gb 12Ram 64Mp
"Muy buen producto Calidad-Precio, excelente rendimiento.",5,Xiaomi,Xiaomi Poco X6 Pro 5G 512Gb 12Ram 64Mp
"Es un telefono versatil, con muchas opciones de personalizacion a nivel de software, procesador fluido y gran espacio y memoria. El unico pero es la c치mara, aunque tiene buena resoluci칩n podria ser mejor.",5,Xiaomi,Xiaomi Poco X6 Pro 5G 512Gb 12Ram 64Mp
"El celular es de muy buena calidad, r치pido, sencillo de manejar y muy c칩modo su uso",5,Xiaomi,Xiaomi Poco X6 Pro 5G 512Gb 12Ram 64Mp
S칤 perfecto,5,Xiaomi,Xiaomi Poco X6 Pro 5G 512Gb 12Ram 64Mp
"Un equipo con caracter칤sticas premium a precio de gama media. Su peso es ideal, su c치mara cumple, su pantalla tiene excelente resoluci칩n y el sensor de huella en pantalla es preciso.",5,Xiaomi,Xiaomi Poco X6 Pro 5G 512Gb 12Ram 64Mp
"id칠ntico a la descripci칩n, muy buena bater칤a, el rendimiento es excelente, alcanza a correr a 60FPS los juegos",5,Xiaomi,Xiaomi Poco X6 Pro 5G 512Gb 12Ram 64Mp
"Buen celular, pero esperaba m치s, lleg칩 a tiempo y bien empacado.",4,Xiaomi,Xiaomi Poco X6 Pro 5G 512Gb 12Ram 64Mp
Bueno,4,Xiaomi,Xiaomi Poco X6 Pro 5G 512Gb 12Ram 64Mp
"Celular de gama media alta, exelente tel칠fono",4,Xiaomi,Xiaomi Poco X6 Pro 5G 512Gb 12Ram 64Mp
"Una vez recibido inicie la configuraci칩n del celular, pasados unos minutos del proceso la pantalla cambio de colores y no volvi칩 a su estado normal. Hoy (03/04/2024) inicio el proceso para pedir garant칤a o que me devuelvan mi dinero",1,Xiaomi,Xiaomi Poco X6 Pro 5G 512Gb 12Ram 64Mp
El mejor del mercado igual al de la foto,5,Xiaomi,Xiaomi Poco X6 Pro 5G 512Gb 12Ram 64Mp
"Excelente presentaci칩n, id칠ntico a las fotos",5,Xiaomi,Xiaomi Poco X6 Pro 5G 512Gb 12Ram 64Mp
Expectativas cumplidas,5,Xiaomi,Xiaomi Poco X6 Pro 5G 512Gb 12Ram 64Mp
"Es muy bueno para juegos, me va super bien",5,Xiaomi,Xiaomi Poco X6 Pro 5G 512Gb 12Ram 64Mp
El producto es igual al de la foto,5,Xiaomi,Xiaomi Poco X6 Pro 5G 512Gb 12Ram 64Mp
"Es muy bueno para juegos, me va super bien",5,Xiaomi,Xiaomi Poco X6 Pro 5G 512Gb 12Ram 64Mp
El producto es igual al de la foto,5,Xiaomi,Xiaomi Poco X6 Pro 5G 512Gb 12Ram 64Mp
"Excelente, el producto entregado corresponde al mostrado en la p치gina y es de excelente calidad!",5,Xiaomi,Xiaomi Poco X6 Pro 5G 512Gb 12Ram 64Mp
Es exactamente a lo publicado en la foto,5,Xiaomi,Xiaomi Poco X6 Pro 5G 512Gb 12Ram 64Mp
"Lleg칩 tal cu치l como est치 en la descripci칩n. Muy buen equipo, el 칰nico detalle es que siento que la bater칤a la consume muy r치pido, aunque eso se compensa con la rapidez que carga.",5,Xiaomi,Xiaomi Poco X6 Pro 5G 512Gb 12Ram 64Mp
Poco X6 Pro 12 512gb. Equipo excelentemente balanceado .Calidad precio justo.,5,Xiaomi,Xiaomi Poco X6 Pro 5G 512Gb 12Ram 64Mp
Excelente acabado el cuero vegano,5,Xiaomi,Xiaomi Poco X6 Pro 5G 512Gb 12Ram 64Mp
"Excelente calidad, producto nuevo, tal como en la descripci칩n",5,Xiaomi,Xiaomi Poco X6 Pro 5G 512Gb 12Ram 64Mp
El producto es muy bueno tal como se describe,5,Xiaomi,Xiaomi Poco X6 Pro 5G 512Gb 12Ram 64Mp
Execelente especificaciones,5,Xiaomi,Xiaomi Poco X6 Pro 5G 512Gb 12Ram 64Mp
Buena calidad,5,Xiaomi,Xiaomi Poco X6 Pro 5G 512Gb 12Ram 64Mp
Celular con precio de gama media pero con caracter칤sticas de gama alta,5,Xiaomi,Xiaomi Poco X6 Pro 5G 512Gb 12Ram 64Mp
"Excelente todo perfecto, lo mejor",5,Xiaomi,Xiaomi Poco X6 Pro 5G 512Gb 12Ram 64Mp
"Buena calidad , exactamente como se muestra en la p치gina ,",5,Xiaomi,Xiaomi Poco X6 Pro 5G 512Gb 12Ram 64Mp
Excelente me llego el dispositivo que era todo en su caja buen tiempo de entrega lo recomiendo 10/10,5,Xiaomi,Xiaomi Poco X6 Pro 5G 512Gb 12Ram 64Mp
Excelente producto todo perfecto,4,Xiaomi,Xiaomi Poco X6 Pro 5G 512Gb 12Ram 64Mp
Bien llego en buen estado,4,Xiaomi,Xiaomi Poco X6 Pro 5G 512Gb 12Ram 64Mp
"El tama침o corresponde, es muy similar a la foto, la calidad se ve buena",4,Xiaomi,Xiaomi Poco X6 Pro 5G 512Gb 12Ram 64Mp
El mejor celular que existe en cuanto calidad y precio,5,Xiaomi,Xiaomi Poco X6 Pro 5G 512Gb 12Ram 64Mp
Excelente calidad y cuenta con unas s칰per caracter칤sticas como la c치mara y capacidad,5,Xiaomi,Xiaomi Poco X6 Pro 5G 512Gb 12Ram 64Mp
Es exactamente como se pidio,5,Xiaomi,Xiaomi Poco X6 Pro 5G 512Gb 12Ram 64Mp
Es una m치quina lo estoy probando con Android auto y es incre칤ble no se pega ni nada adem치s no se calienta la bater칤a dura lo suficiente,5,Xiaomi,Xiaomi Poco X6 Pro 5G 512Gb 12Ram 64Mp
Los materiales no son muy premium pero la calidad del sistema operativo y la velocidad y por el precio est치 s칰per bien,5,Xiaomi,Xiaomi Poco X6 Pro 5G 512Gb 12Ram 64Mp
Buena calidad era lo esperado,5,Xiaomi,Xiaomi Poco X6 Pro 5G 512Gb 12Ram 64Mp
Es una m치quina lo estoy probando con Android auto y es incre칤ble no se pega ni nada adem치s no se calienta la bater칤a dura lo suficiente,5,Xiaomi,Xiaomi Poco X6 Pro 5G 512Gb 12Ram 64Mp
Los materiales no son muy premium pero la calidad del sistema operativo y la velocidad y por el precio est치 s칰per bien,5,Xiaomi,Xiaomi Poco X6 Pro 5G 512Gb 12Ram 64Mp
Buena calidad era lo esperado,5,Xiaomi,Xiaomi Poco X6 Pro 5G 512Gb 12Ram 64Mp
Excelente calidad y precio,5,Xiaomi,Xiaomi Poco X6 Pro 5G 512Gb 12Ram 64Mp
Buenas calidad,5,Xiaomi,Xiaomi Poco X6 Pro 5G 512Gb 12Ram 64Mp
El producto es exactamente igual a las fotos y son las mismas caracteristicas. La entrega fue muy rapida!,5,Xiaomi,Xiaomi Poco X6 Pro 5G 512Gb 12Ram 64Mp
"Es perfecto. Tu tama침o. La calidad, la potencia su c치mara y su precio El mejor tel칠fono gama media del 2024",5,Xiaomi,Xiaomi Poco X6 Pro 5G 512Gb 12Ram 64Mp
"Fue muy buena la experiencia, llego muy r치pido y est치 muy bonito el producto",5,Xiaomi,Xiaomi Poco X6 Pro 5G 512Gb 12Ram 64Mp
Es exactamente igual a la foto y las mismas especificaciones que estaban descritas.,5,Xiaomi,Xiaomi Poco X6 Pro 5G 512Gb 12Ram 64Mp
Igual a lo esperado y la calidad es excelente,5,Xiaomi,Xiaomi Poco X6 Pro 5G 512Gb 12Ram 64Mp
Si el producto es exactamente igual al de la p치gina,5,Xiaomi,Xiaomi Poco X6 Pro 5G 512Gb 12Ram 64Mp
"Es igual al de la foto, y de muy buena calidad",5,Xiaomi,Xiaomi Poco X6 Pro 5G 512Gb 12Ram 64Mp
Es de muy buena calidad,5,Xiaomi,Xiaomi Poco X6 Pro 5G 512Gb 12Ram 64Mp
Excelente producto,5,Xiaomi,Xiaomi Poco X6 Pro 5G 512Gb 12Ram 64Mp
"Excelente producto, cumple con todas las especificaciones",5,Xiaomi,Xiaomi Poco X6 Pro 5G 512Gb 12Ram 64Mp
"Excelente producto, rompi칩 con todas mis espectativas ...le doy 10/10",5,Xiaomi,Xiaomi Poco X6 Pro 5G 512Gb 12Ram 64Mp
Excelente celular. Su relaci칩n precio- calidad es insuperable.El env칤o s칰per r치pido. Felicitaciones.,5,Xiaomi,Xiaomi Poco X6 Pro 5G 512Gb 12Ram 64Mp
Corresponde al producto,4,Xiaomi,Xiaomi Poco X6 Pro 5G 512Gb 12Ram 64Mp
Exelente producto era lo que esperaba recibir.,4,Xiaomi,Xiaomi Poco X6 Pro 5G 512Gb 12Ram 64Mp
"El tel칠fono ha estado muy bien, solo he tenido inconvenientes con algunas aplicaciones, pero todo va de maravilla",4,Xiaomi,Xiaomi Poco X6 Pro 5G 512Gb 12Ram 64Mp
"La bater칤a dura menos de 13 horas y es una terrible desventaja. Se supone que la bater칤a es de 5.000 miliamperios, pero no dura las 24 horas que dice en la publicidad del tel칠fono.",4,Xiaomi,Xiaomi Poco X6 Pro 5G 512Gb 12Ram 64Mp
"Buena calidad, falta m치s resoluci칩n de las c치maras.",3,Xiaomi,Xiaomi Poco X6 Pro 5G 512Gb 12Ram 64Mp
El Tama침o corresponde muy buena calidad,5,Xiaomi,Xiaomi Poco X6 Pro 5G 512Gb 12Ram 64Mp
"El tel칠fono se recibi칩 a conformidad, como se describe en la descripci칩n del producto. La entrega fue de un d칤a para otro, todo bien.",5,Xiaomi,Xiaomi Poco X6 Pro 5G 512Gb 12Ram 64Mp
Buena,5,Xiaomi,Xiaomi Poco X6 Pro 5G 512Gb 12Ram 64Mp
"Exelente, tal cual lo esperaba, muy bonito",5,Xiaomi,Xiaomi Poco X6 Pro 5G 512Gb 12Ram 64Mp
Excelentes caracter칤sticas y calidad,5,Xiaomi,Xiaomi Poco X6 Pro 5G 512Gb 12Ram 64Mp
"Buena calidad, viene con cargador y cable los cu치l se agradece, excelente c치mara, un dispositivo r치pido, sin embargo me gustar칤a que le durar치 m치s la bater칤a",5,Xiaomi,Xiaomi Poco X6 Pro 5G 512Gb 12Ram 64Mp
"Exelente, tal cual lo esperaba, muy bonito",5,Xiaomi,Xiaomi Poco X6 Pro 5G 512Gb 12Ram 64Mp
Excelentes caracter칤sticas y calidad,5,Xiaomi,Xiaomi Poco X6 Pro 5G 512Gb 12Ram 64Mp
"Buena calidad, viene con cargador y cable los cu치l se agradece, excelente c치mara, un dispositivo r치pido, sin embargo me gustar칤a que le durar치 m치s la bater칤a",5,Xiaomi,Xiaomi Poco X6 Pro 5G 512Gb 12Ram 64Mp
Es bastante r치pido y tiene buena camara,5,Xiaomi,Xiaomi Poco X6 Pro 5G 512Gb 12Ram 64Mp
Si igual como se ve y se ve de buena calidad,5,Xiaomi,Xiaomi Poco X6 Pro 5G 512Gb 12Ram 64Mp
"Mi primer gama media -alta lleg칩 muy bien en su caja totalmente sellada, el color amarillo es hermoso recomendado ,posdata..no me llego la factura f칤sica estoy esperando aun la eletronica",5,Xiaomi,Xiaomi Poco X6 Pro 5G 512Gb 12Ram 64Mp
"Todo perfecto, lleg칩 intacto y buen funcionamiento, estoy muy feliz con el celular adquirido",5,Xiaomi,Xiaomi Poco X6 Pro 5G 512Gb 12Ram 64Mp
Todo cumple con la descripci칩n,5,Xiaomi,Xiaomi Poco X6 Pro 5G 512Gb 12Ram 64Mp
Super Era lo que esperaba gracias,5,Xiaomi,Xiaomi Poco X6 Pro 5G 512Gb 12Ram 64Mp
"Es tal como dice en la descripci칩n, super genial, y su fluides en muy buena es perfecto para mis transmisi칩nes en vivo en tiktok. Gracias que buen celular.",5,Xiaomi,Xiaomi Poco X6 Pro 5G 512Gb 12Ram 64Mp
"Igual a la foto, tama침o adecuado, buen procesador, fotograf칤a adecuada.",5,Xiaomi,Xiaomi Poco X6 Pro 5G 512Gb 12Ram 64Mp
"Igual a la foto, excelente tel칠fono lleg칩 perfecto y funciona de igual manera...",5,Xiaomi,Xiaomi Poco X6 Pro 5G 512Gb 12Ram 64Mp
Excelente calidad,5,Xiaomi,Xiaomi Poco X6 Pro 5G 512Gb 12Ram 64Mp
Hermoso,5,Xiaomi,Xiaomi Poco X6 Pro 5G 512Gb 12Ram 64Mp
Excelente producto,5,Xiaomi,Xiaomi Poco X6 Pro 5G 512Gb 12Ram 64Mp
Tama침o correcto Muy buena calidad El color ideal,5,Xiaomi,Xiaomi Poco X6 Pro 5G 512Gb 12Ram 64Mp
Llego el dispositivo correcto y en buen tiempo de entrega,5,Xiaomi,Xiaomi Poco X6 Pro 5G 512Gb 12Ram 64Mp
"El celular es igual que el de la foto, algo negativo es que la bater칤a ni dura mucho",4,Xiaomi,Xiaomi Poco X6 Pro 5G 512Gb 12Ram 64Mp
"Es lo que estaba esperando, buena calidad precio accesible estoy conforme con la compra",4,Xiaomi,Xiaomi Poco X6 Pro 5G 512Gb 12Ram 64Mp
Tama침o seg칰n las especificaciones de buena calidad lo 칰nico malo es que hay algunas aplicaciones mal optimizadas y drenan demasiado la bater칤a,4,Xiaomi,Xiaomi Poco X6 Pro 5G 512Gb 12Ram 64Mp
Las descripci칩n es precisa en cuando a dimensiones,4,Xiaomi,Xiaomi Poco X6 Pro 5G 512Gb 12Ram 64Mp
"El producto corresponde pero se robaron el convertidor del cargador, en la caja trae el espacio donde deberia estar pero no lo traite.. El. Producto es bueno pero el vendedor pauperrimo.",3,Xiaomi,Xiaomi Poco X6 Pro 5G 512Gb 12Ram 64Mp
"El tama침o es perfecto, la calidad de construcci칩n me ha parecido de primera. Las c치maras son magn칤ficas y la carga ultra r치pida es de lo mejor, entre muchas otras cosas. Excelente costo-beneficio.",5,Xiaomi,Xiaomi Redmi Note 13 Pro Plus 5G 512Gb 12Ram 200Mp
"Es Perfecto! Tal cual la foto, las caracter칤sticas, la c치mara, el tama침o es el adecuado, y sobretodo su capacidad de almacenamiento",5,Xiaomi,Xiaomi Redmi Note 13 Pro Plus 5G 512Gb 12Ram 200Mp
si es el producto que ped칤,5,Xiaomi,Xiaomi Redmi Note 13 Pro Plus 5G 512Gb 12Ram 200Mp
"Es Perfecto! Tal cual la foto, las caracter칤sticas, la c치mara, el tama침o es el adecuado, y sobretodo su capacidad de almacenamiento",5,Xiaomi,Xiaomi Redmi Note 13 Pro Plus 5G 512Gb 12Ram 200Mp
si es el producto que ped칤,5,Xiaomi,Xiaomi Redmi Note 13 Pro Plus 5G 512Gb 12Ram 200Mp
"Lleg칩 r치pido, y es igual a las especificaciones q aparecen en la descripci칩n. Adem치s el equipo trabajo muy bien",5,Xiaomi,Xiaomi Redmi Note 13 Pro Plus 5G 512Gb 12Ram 200Mp
Exvelente,5,Xiaomi,Xiaomi Redmi Note 13 Pro Plus 5G 512Gb 12Ram 200Mp
Tiene el tama침o ideal y de buena calidad,5,Xiaomi,Xiaomi Redmi Note 13 Pro Plus 5G 512Gb 12Ram 200Mp
Todo lo que ofrecen en la pagina corresponde con el articulo,5,Xiaomi,Xiaomi Redmi Note 13 Pro Plus 5G 512Gb 12Ram 200Mp
"Muy buen equipo, excelente tecnolog칤a !!",5,Xiaomi,Xiaomi Redmi Note 13 Pro Plus 5G 512Gb 12Ram 200Mp
Es un equipo genial,5,Xiaomi,Xiaomi Redmi Note 13 Pro Plus 5G 512Gb 12Ram 200Mp
"El tiempo de entrega fue antes de lo esperado, y el celular tal cual las caracter칤sticas indicadas",5,Xiaomi,Xiaomi Redmi Note 13 Pro Plus 5G 512Gb 12Ram 200Mp
Me encant칩,5,Xiaomi,Xiaomi Redmi Note 13 Pro Plus 5G 512Gb 12Ram 200Mp
"Excelente producto, exacto lo que ped칤",5,Xiaomi,Xiaomi Redmi Note 13 Pro Plus 5G 512Gb 12Ram 200Mp
"El producto es tal cual lo ofrecido, corresponde con la foto promocionada",5,Xiaomi,Xiaomi Redmi Note 13 Pro Plus 5G 512Gb 12Ram 200Mp
Cumpli칩 con las expectativas,5,Xiaomi,Xiaomi Redmi Note 13 Pro Plus 5G 512Gb 12Ram 200Mp
"Excelente, cumpli칩 todas mis expectativas",5,Xiaomi,Xiaomi Redmi Note 13 Pro Plus 5G 512Gb 12Ram 200Mp
Excelente producto,5,Xiaomi,Xiaomi Redmi Note 13 Pro Plus 5G 512Gb 12Ram 200Mp
"El tama침o y su calidad son buenos ,lo que no me gusta es la cantidad de propaganda que aparece cuando va a hacer una llamada",4,Xiaomi,Xiaomi Redmi Note 13 Pro Plus 5G 512Gb 12Ram 200Mp
Es igual a la foto y el material parece de buena calidad,4,Xiaomi,Xiaomi Redmi Note 13 Pro Plus 5G 512Gb 12Ram 200Mp
Corresponde con la descripci칩n,4,Xiaomi,Xiaomi Redmi Note 13 Pro Plus 5G 512Gb 12Ram 200Mp
Producto en perfecto estado...con un rendimiento sin igual y un sistema operativo muy intuitivo..lamentablemente no ven칤a el convertidor de cargador ..as칤 que tuve que hacer parte de este fallo ..por lo dem치s satisfecho con los tiempos de respuesta entrega en perfecto estado y cuidado con seguridad comprar칠 recurrentemente con Falabella .com,4,Xiaomi,Xiaomi Redmi Note 13 Pro Plus 5G 512Gb 12Ram 200Mp
"Se le acaba la bater칤a muy r치pido y viene con un cargador que no sirve en Colombia, toca comprarle adaptador. Tampoco trae entrada para los aud칤fonos convencionales",3,Xiaomi,Xiaomi Redmi Note 13 Pro Plus 5G 512Gb 12Ram 200Mp
Es imprescindible la presentaci칩n y calidad de los materiales.. Sin duda alguna cumpli칩 con todas las espectativas de un producto de alto valor y calidad.. Estoy satisfecho,5,Xiaomi,Xiaomi Redmi Note 13 Pro Plus 5G 512Gb 12Ram 200Mp
Llego rapido y cumplio con las espectativas,5,Xiaomi,Xiaomi Redmi Note 13 Pro Plus 5G 512Gb 12Ram 200Mp
Exelente calidad,5,Xiaomi,Xiaomi Redmi Note 13 Pro Plus 5G 512Gb 12Ram 200Mp
Todo est치 s칰per... Tama침o y caracter칤sticas,5,Xiaomi,Xiaomi Redmi Note 13 Pro Plus 5G 512Gb 12Ram 200Mp
Buenas calidad,5,Xiaomi,Xiaomi Redmi Note 13 Pro Plus 5G 512Gb 12Ram 200Mp
Exelente calidad,5,Xiaomi,Xiaomi Redmi Note 13 Pro Plus 5G 512Gb 12Ram 200Mp
Todo est치 s칰per... Tama침o y caracter칤sticas,5,Xiaomi,Xiaomi Redmi Note 13 Pro Plus 5G 512Gb 12Ram 200Mp
Buenas calidad,5,Xiaomi,Xiaomi Redmi Note 13 Pro Plus 5G 512Gb 12Ram 200Mp
Todo ok,5,Xiaomi,Xiaomi Redmi Note 13 Pro Plus 5G 512Gb 12Ram 200Mp
"Super bueno a funcionado perfectamente, el mejor por este precio",5,Xiaomi,Xiaomi Redmi Note 13 Pro Plus 5G 512Gb 12Ram 200Mp
"Recomiendo 100% meste producto, excelente calidad y f치cil de usar.. Buena relaci칩n precio/calidad.",5,Xiaomi,Xiaomi Redmi Note 13 Pro Plus 5G 512Gb 12Ram 200Mp
Un excelente tel칠fono Buenas camaras Y super de memoria,5,Xiaomi,Xiaomi Redmi Note 13 Pro Plus 5G 512Gb 12Ram 200Mp
Es un producto bueno Tiene buena memoria Es bonito Me gust칩 demasiado,5,Xiaomi,Xiaomi Redmi Note 13 Pro Plus 5G 512Gb 12Ram 200Mp
El producto es genial cumple con lo que requer칤a,5,Xiaomi,Xiaomi Redmi Note 13 Pro Plus 5G 512Gb 12Ram 200Mp
Excelente equipo,5,Xiaomi,Xiaomi Redmi Note 13 Pro Plus 5G 512Gb 12Ram 200Mp
"Excelente tama침o, peso y prestaciones del equipo",5,Xiaomi,Xiaomi Redmi Note 13 Pro Plus 5G 512Gb 12Ram 200Mp
"Igual a la foto, calidad de materiales, bater칤a y sistema operativo muy buenos",5,Xiaomi,Xiaomi Redmi Note 13 Pro Plus 5G 512Gb 12Ram 200Mp
Muy buena calidad todo me gust칩 mucho super칩 mis expectativas,5,Xiaomi,Xiaomi Redmi Note 13 Pro Plus 5G 512Gb 12Ram 200Mp
Calidad,5,Xiaomi,Xiaomi Redmi Note 13 Pro Plus 5G 512Gb 12Ram 200Mp
Es buena calidad,5,Xiaomi,Xiaomi Redmi Note 13 Pro Plus 5G 512Gb 12Ram 200Mp
"Es un dispositivo 100% original, no le doy las 5 estrellas. Ya que esperaba que la bater칤a durar치 un poco m치s y la c치mara de 200 mpx a칰n tiene cositas por mejorar... Pero por el precio lo vale... Gran dispositivo",4,Xiaomi,Xiaomi Redmi Note 13 Pro Plus 5G 512Gb 12Ram 200Mp
"Buen producto, lleno mis expectativas",4,Xiaomi,Xiaomi Redmi Note 13 Pro Plus 5G 512Gb 12Ram 200Mp
Buena apariencia y capacidad,4,Xiaomi,Xiaomi Redmi Note 13 Pro Plus 5G 512Gb 12Ram 200Mp
La c치mara trasera sobresale mucho y es algo inc칩moda. La bater칤a no dura tanto como se esperar칤a Cuando tiene un uso moderado - alto el tel칠fono se recalienta m치s de lo esperado Por lo dem치s es de buena calidad y tiene buen rendimiento,4,Xiaomi,Xiaomi Redmi Note 13 Pro Plus 5G 512Gb 12Ram 200Mp
"El producto corresponde, la carga de la bater칤a dura poco.",3,Xiaomi,Xiaomi Redmi Note 13 Pro Plus 5G 512Gb 12Ram 200Mp
"me encanto facil de instalacion de las aplicaciones, excelente producto",5,Xiaomi,Xiaomi Redmi Note 13 Pro Plus 5G 512Gb 12Ram 200Mp
Es un s칰per tel칠fono una m치quina,5,Xiaomi,Xiaomi Redmi Note 13 Pro Plus 5G 512Gb 12Ram 200Mp
"Me gusta la fluidez que tiene el m칩vil, la c치mara trasera tambi칠n me pareci칩 buena, el aspecto que m치s me agrada es la velocidad de carga",5,Xiaomi,Xiaomi Redmi Note 13 Pro Plus 5G 512Gb 12Ram 200Mp
Es un s칰per tel칠fono una m치quina,5,Xiaomi,Xiaomi Redmi Note 13 Pro Plus 5G 512Gb 12Ram 200Mp
"Me gusta la fluidez que tiene el m칩vil, la c치mara trasera tambi칠n me pareci칩 buena, el aspecto que m치s me agrada es la velocidad de carga",5,Xiaomi,Xiaomi Redmi Note 13 Pro Plus 5G 512Gb 12Ram 200Mp
Perfecto celular que cumple con cada una de las descripci칩n y la camara es lo m치s espectacular 游땘,5,Xiaomi,Xiaomi Redmi Note 13 Pro Plus 5G 512Gb 12Ram 200Mp
Bueno muy,5,Xiaomi,Xiaomi Redmi Note 13 Pro Plus 5G 512Gb 12Ram 200Mp
Todo seg칰n las caracter칤sticas ofrecidas,5,Xiaomi,Xiaomi Redmi Note 13 Pro Plus 5G 512Gb 12Ram 200Mp
"La descripci칩n es muy exacta, la duraci칩n de la bater칤a un d칤a con uso constante,la carga super r치pida, buena rapidez, la funda con la que viene muy buena!",5,Xiaomi,Xiaomi Redmi Note 13 Pro Plus 5G 512Gb 12Ram 200Mp
"Es exactamente al producto que ofrece, muy buena calidad",5,Xiaomi,Xiaomi Redmi Note 13 Pro Plus 5G 512Gb 12Ram 200Mp
"Excelente calidad, mas de lo que esperaba",5,Xiaomi,Xiaomi Redmi Note 13 Pro Plus 5G 512Gb 12Ram 200Mp
"Excelente producto, muy funcional",5,Xiaomi,Xiaomi Redmi Note 13 Pro Plus 5G 512Gb 12Ram 200Mp
"Excelente, es lo que esperaba",5,Xiaomi,Xiaomi Redmi Note 13 Pro Plus 5G 512Gb 12Ram 200Mp
buena calidad,5,Xiaomi,Xiaomi Redmi Note 13 Pro Plus 5G 512Gb 12Ram 200Mp
"El tama침o corresponde, es igual al de la foto, buena calidad",5,Xiaomi,Xiaomi Redmi Note 13 Pro Plus 5G 512Gb 12Ram 200Mp
"Muy bueno, todo lo que se espera lo tiene el celular",5,Xiaomi,Xiaomi Redmi Note 13 Pro Plus 5G 512Gb 12Ram 200Mp
Bien peoducto,4,Xiaomi,Xiaomi Redmi Note 13 Pro Plus 5G 512Gb 12Ram 200Mp
El cargador tiene terminales redondos y no encuentro entonces c칩mo conectarlo en los toma corrientes. No encuentro nada en Internet al respecto ni en la caja del tel칠fono,4,Xiaomi,Xiaomi Redmi Note 13 Pro Plus 5G 512Gb 12Ram 200Mp
