comentario,calificacion,marca,modelo
Es excelente tal como lo ped칤,5,Apple,iPhone 13 128 GB 5G 4GB RAM
excelente calidad. y servicio,5,Apple,iPhone 13 128 GB 5G 4GB RAM
"Excelente producto, igual a la foto",5,Apple,iPhone 13 128 GB 5G 4GB RAM
"Estoy muy contenta ya que ten칤a el XR y no le duraba nada la bater칤a. Con este estoy feliz por su duraci칩n, es mas liviano, el color azul media noche es pr치cticamente negro lo cual est치 perfecto para m칤 y su imagen es considerablemente mejor !!!!",5,Apple,iPhone 13 128 GB 5G 4GB RAM
"El producto es tal cual como se ve en las im치genes, la calidad es excelente, fluye muy bien el sistema, la c치mara es muy buena, pero si eres una persona que usa mucho el celular en el d칤a no es tan recomendable ya que su bater칤a te dar치 una autonom칤a de menos de un d칤a en uso continuo.",5,Apple,iPhone 13 128 GB 5G 4GB RAM
"Igual a la foto, excelente producto",5,Apple,iPhone 13 128 GB 5G 4GB RAM
"Excelente calidad , perfecto . Muy contento con mi iPhone 13",5,Apple,iPhone 13 128 GB 5G 4GB RAM
Maravilloso 10/10,5,Apple,iPhone 13 128 GB 5G 4GB RAM
El producto es exacto como lo buscaba,5,Apple,iPhone 13 128 GB 5G 4GB RAM
"S칰per bien todo, la entrega fue s칰per r치pida y hasta el momento todo bien",5,Apple,iPhone 13 128 GB 5G 4GB RAM
Igual a la descripci칩n Excelente calidad,5,Apple,iPhone 13 128 GB 5G 4GB RAM
Excelente producto y corresponde con lo esperado,5,Apple,iPhone 13 128 GB 5G 4GB RAM
Era lo q quer칤a todo estuvo perfecto,5,Apple,iPhone 13 128 GB 5G 4GB RAM
Fluido 치gil,5,Apple,iPhone 13 128 GB 5G 4GB RAM
Entrega r치pida y excelente calidad,5,Apple,iPhone 13 128 GB 5G 4GB RAM
"El tama침o es el adecuado, es un regalo de navidad para el 24 todav칤a no lo abro",5,Apple,iPhone 13 128 GB 5G 4GB RAM
Muy buena calidad,5,Apple,iPhone 13 128 GB 5G 4GB RAM
sin sorpresas lo esperado,5,Apple,iPhone 13 128 GB 5G 4GB RAM
"Tal cual en la foto, sin ning칰n problema. Todo perfecto",5,Apple,iPhone 13 128 GB 5G 4GB RAM
Es celular es perfecto de tama침o el color es espectacular y exelente desempe침o.,5,Apple,iPhone 13 128 GB 5G 4GB RAM
"Es el equipo esperado, muy buena calidad",5,Apple,iPhone 13 128 GB 5G 4GB RAM
Igual a la foto,5,Apple,iPhone 13 128 GB 5G 4GB RAM
"Igual s la foto, el color genial, me lleg칩 al otro d칤a, feliz de recibirlo a tiempo y cuando lo necesitaba",5,Apple,iPhone 13 128 GB 5G 4GB RAM
Contenta con el producto tama침o y c치lida,5,Apple,iPhone 13 128 GB 5G 4GB RAM
Es igual al mostrado en las imagenes,5,Apple,iPhone 13 128 GB 5G 4GB RAM
El equipo perfecto,5,Apple,iPhone 13 128 GB 5G 4GB RAM
Hermoso celular cumpli칩 todas mis expectativas,5,Apple,iPhone 13 128 GB 5G 4GB RAM
"Cumpli칩 con todas mis expectativas, buen precio y muy buena calidad",5,Apple,iPhone 13 128 GB 5G 4GB RAM
Me gust칩 bastante y color es muy bonito,5,Apple,iPhone 13 128 GB 5G 4GB RAM
Es exacto a lo que se public칩 y de la mejor calidad,5,Apple,iPhone 13 128 GB 5G 4GB RAM
"Es Apple as칤 que es muy buena calidad, me gusta que lo consegu칤 al mejor precio con ustedes",5,Apple,iPhone 13 128 GB 5G 4GB RAM
"Buena calidad, es Apple y completamente intuitivo",5,Apple,iPhone 13 128 GB 5G 4GB RAM
Igual a lo ofrecido. Muy cumplidos,5,Apple,iPhone 13 128 GB 5G 4GB RAM
Elnproducto recibido ea acorde con la imagen de la publicidad,5,Apple,iPhone 13 128 GB 5G 4GB RAM
Es de muy buena calidad y las fotos quedan s칰per,5,Apple,iPhone 13 128 GB 5G 4GB RAM
Excelente calidad tal cual la descripci칩n,5,Apple,iPhone 13 128 GB 5G 4GB RAM
"Excelente producto, cumple con las espectativas de acuerdo a la informaci칩n suministrada por el vendedor x es un regalo para mi hija.",5,Apple,iPhone 13 128 GB 5G 4GB RAM
Todas las caracter칤sticas correspond칤an a lo ofrecido,5,Apple,iPhone 13 128 GB 5G 4GB RAM
"En efecto es un muy buen producto, valio la pena por un muy buen precio, venia de un iphone se 2 y el cambio a este iphone 13 se nota bastante, excelente compra y actualizaci칩n.",5,Apple,iPhone 13 128 GB 5G 4GB RAM
"Calidad, tama침o excelente",5,Apple,iPhone 13 128 GB 5G 4GB RAM
Igual al de la foto,5,Apple,iPhone 13 128 GB 5G 4GB RAM
"Muy bien, todo cumple a nivel de tama침o, calidad y es igual al solicitado.",5,Apple,iPhone 13 128 GB 5G 4GB RAM
Gran calidad,5,Apple,iPhone 13 128 GB 5G 4GB RAM
Todo fue c칩mo se describe en la p치gina. Espectacular,5,Apple,iPhone 13 128 GB 5G 4GB RAM
Con productos Apple no hay pierde,5,Apple,iPhone 13 128 GB 5G 4GB RAM
Buena calidad El tama침o perfecto Muy buena la c치mara,5,Apple,iPhone 13 128 GB 5G 4GB RAM
Me gusto mucho,5,Apple,iPhone 13 128 GB 5G 4GB RAM
"Excelente calidad, imagen y colores del celular",5,Apple,iPhone 13 128 GB 5G 4GB RAM
Es muy buena calidad y es lo que ped칤,5,Apple,iPhone 13 128 GB 5G 4GB RAM
Super espect치cular Gracias,5,Apple,iPhone 13 128 GB 5G 4GB RAM
"Igual a la descripci칩n, tama침o y color full",5,Apple,iPhone 13 128 GB 5G 4GB RAM
"Excelente producto, tal cu치l se ve en las fotos , calidad y tama침o",5,Apple,iPhone 13 128 GB 5G 4GB RAM
Es exactamente lo que ped칤.,5,Apple,iPhone 13 128 GB 5G 4GB RAM
"Es un producto incre칤ble, 100% recomendado.",5,Apple,iPhone 13 128 GB 5G 4GB RAM
"Es de un tama침o adecuado, ligero y de buena calidad hasta el momento",5,Apple,iPhone 13 128 GB 5G 4GB RAM
"Igual a la foto, tama침o y calidad excelentes",5,Apple,iPhone 13 128 GB 5G 4GB RAM
"Color igual a la foto, cumple con las especificaciones y descripci칩n que colocan del producto. Es un buen producto para comenzar con la marca de Apple 游꼝",5,Apple,iPhone 13 128 GB 5G 4GB RAM
Excelente c치mara 游녧...el rendimiento y velocidad super!,5,Apple,iPhone 13 128 GB 5G 4GB RAM
Excelente producto,5,Apple,iPhone 13 128 GB 5G 4GB RAM
Todo perfecto,5,Apple,iPhone 13 128 GB 5G 4GB RAM
"Es igual al de la foto, la mejor c치mara y dura mas la bater칤a",5,Apple,iPhone 13 128 GB 5G 4GB RAM
El iPhone es tal cual lo que esperaba Exelente producto,5,Apple,iPhone 13 128 GB 5G 4GB RAM
"El color, la calidad, la c치mara",5,Apple,iPhone 13 128 GB 5G 4GB RAM
Todo bien,5,Apple,iPhone 13 128 GB 5G 4GB RAM
Excelente producto.colmo mis expectativas.igual a la foto,5,Apple,iPhone 13 128 GB 5G 4GB RAM
"Calidad, rendimiento incre칤ble y muy vers치til",5,Apple,iPhone 13 128 GB 5G 4GB RAM
rapidez,5,Apple,iPhone 13 128 GB 5G 4GB RAM
Fue entregado en el tiempo prometido,5,Apple,iPhone 13 128 GB 5G 4GB RAM
Todo perfecto,5,Apple,iPhone 13 128 GB 5G 4GB RAM
Todo acorde a lo solicitado y presentado.,4,Apple,iPhone 13 128 GB 5G 4GB RAM
Muy buen tama침o,4,Apple,iPhone 13 128 GB 5G 4GB RAM
Excelente,4,Apple,iPhone 13 128 GB 5G 4GB RAM
Buena,4,Apple,iPhone 13 128 GB 5G 4GB RAM
Es lo que esperaba,4,Apple,iPhone 13 128 GB 5G 4GB RAM
"Producto Igual a lo que me ofrecieron, bien",4,Apple,iPhone 13 128 GB 5G 4GB RAM
"Es igual a la foto , el tama침o y el rendimiento han sido 칩ptimos con dos semanas de uso. Pero al momento de hacer la reclamaci칩n en tienda falabella San Diego Medell칤n no contaban con los accesorios",4,Apple,iPhone 13 128 GB 5G 4GB RAM
Perfecto el tama침a del equipo,4,Apple,iPhone 13 128 GB 5G 4GB RAM
Buena calidad,4,Apple,iPhone 13 128 GB 5G 4GB RAM
"Me gust칩 el tama침o, es igual al de la foto!",3,Apple,iPhone 13 128 GB 5G 4GB RAM
Me parece un producto muy costoso para q no tenga ni el conector ni los aud칤fonos,3,Apple,iPhone 13 128 GB 5G 4GB RAM
"El m칩vil es tal cual la descripci칩n, llego en excelente estado.",5,Apple,iPhone 13 128 GB 5G 4GB RAM
"Excelente equipo, el tama침o corresponde y los acabados son muy buenos.",5,Apple,iPhone 13 128 GB 5G 4GB RAM
Tal cual lo que vi en la p치gina,5,Apple,iPhone 13 128 GB 5G 4GB RAM
El producto es de la mejor calidad y las especificaciones coinciden con lo ofrecido,5,Apple,iPhone 13 128 GB 5G 4GB RAM
"Me encanto! Muy buen celular y la c치mara es incre칤ble, muy buena calidad",5,Apple,iPhone 13 128 GB 5G 4GB RAM
"Corresponde el tama침o, tal cual al de la foto y es excelente la calidad",5,Apple,iPhone 13 128 GB 5G 4GB RAM
El producto es de la mejor calidad y las especificaciones coinciden con lo ofrecido,5,Apple,iPhone 13 128 GB 5G 4GB RAM
"Me encanto! Muy buen celular y la c치mara es incre칤ble, muy buena calidad",5,Apple,iPhone 13 128 GB 5G 4GB RAM
"Corresponde el tama침o, tal cual al de la foto y es excelente la calidad",5,Apple,iPhone 13 128 GB 5G 4GB RAM
"Un tel칠fono muy bueno, y con la promoci칩n de falabella a un precio de locura",5,Apple,iPhone 13 128 GB 5G 4GB RAM
"Igual a la foto, excelente tama침o y calidad",5,Apple,iPhone 13 128 GB 5G 4GB RAM
Excelente celular. Cumpli칩 todas mis expectativas,5,Apple,iPhone 13 128 GB 5G 4GB RAM
El tama침o corresponde vino en buenas condiciones y fue r치pida la entrega,5,Apple,iPhone 13 128 GB 5G 4GB RAM
Buena calidad,5,Apple,iPhone 13 128 GB 5G 4GB RAM
Me encantan los celulares peque침os y este es el mismo de la foto y la calidad espectacular,5,Apple,iPhone 13 128 GB 5G 4GB RAM
Muy buena experiencia era lo que esperaba,5,Apple,iPhone 13 128 GB 5G 4GB RAM
"Es igual a la publicidad que presenta, muy hermoso",5,Apple,iPhone 13 128 GB 5G 4GB RAM
Muy bien,5,Apple,iPhone 13 128 GB 5G 4GB RAM
"Perfecto, el color igual al de la foto, llego s칰per r치pido",5,Apple,iPhone 13 128 GB 5G 4GB RAM
Igual a la foto,5,Apple,iPhone 13 128 GB 5G 4GB RAM
Es igual a la foto del producto y su calidad excelente,5,Apple,iPhone 13 128 GB 5G 4GB RAM
Buena calidad Fotos super excelente,5,Apple,iPhone 13 128 GB 5G 4GB RAM
Todas las caracter칤sticas relacionadas en la aplicaci칩n de Falabella corresponden al producto recibido,5,Apple,iPhone 13 128 GB 5G 4GB RAM
"Me ha ido bien, est치 muy ch칠vere",5,Apple,iPhone 13 128 GB 5G 4GB RAM
Buen estado,5,Apple,iPhone 13 128 GB 5G 4GB RAM
Excelente tal cual la foto,5,Apple,iPhone 13 128 GB 5G 4GB RAM
El producto corresponde totalmente 游녨游낕,5,Apple,iPhone 13 128 GB 5G 4GB RAM
"El producto si corresponde a la imagen de la foto, cumple con todas las especificaciones y una exelente calidad",5,Apple,iPhone 13 128 GB 5G 4GB RAM
"Excelente producto, muy buena calidad, igual como se ve칤a en la foto.",5,Apple,iPhone 13 128 GB 5G 4GB RAM
S칰per lindo y muy r치pido la entrega,5,Apple,iPhone 13 128 GB 5G 4GB RAM
Excelente,5,Apple,iPhone 13 128 GB 5G 4GB RAM
El mejor cel,5,Apple,iPhone 13 128 GB 5G 4GB RAM
Buena calidad,5,Apple,iPhone 13 128 GB 5G 4GB RAM
Excelente producto. Lleg칩 sellado y en perfectas condiciones,5,Apple,iPhone 13 128 GB 5G 4GB RAM
"Excelente, es igual al de la foto, la entrega fue r치pida.",5,Apple,iPhone 13 128 GB 5G 4GB RAM
El tel칠fono corresponde con la descripci칩n,5,Apple,iPhone 13 128 GB 5G 4GB RAM
Buena c치mara Excelente se침al Bien tama침o,5,Apple,iPhone 13 128 GB 5G 4GB RAM
"Excelente calidad, el tama침o corresponde",5,Apple,iPhone 13 128 GB 5G 4GB RAM
"Si es igual, super excelente",5,Apple,iPhone 13 128 GB 5G 4GB RAM
Buena calidad,5,Apple,iPhone 13 128 GB 5G 4GB RAM
Excelente,5,Apple,iPhone 13 128 GB 5G 4GB RAM
E un celular igual a la descripci칩n que vi originalmente en la p치gina El tama침o es acorde y el color muy bonito,5,Apple,iPhone 13 128 GB 5G 4GB RAM
Es de buena calidad Se lo regal칠 a mi hijo,5,Apple,iPhone 13 128 GB 5G 4GB RAM
Igual a la foto,5,Apple,iPhone 13 128 GB 5G 4GB RAM
"Es de buena calidad,el tama침o no corresponde a las medidas de las especificaciones,es un poco m치s peque침o pero es un producto que cumple con las expectativas",5,Apple,iPhone 13 128 GB 5G 4GB RAM
Todo genial,5,Apple,iPhone 13 128 GB 5G 4GB RAM
"Apple fan, se va a la fija con cualquiera de sus productos.",5,Apple,iPhone 13 128 GB 5G 4GB RAM
Muy bueno,5,Apple,iPhone 13 128 GB 5G 4GB RAM
Buen producto,5,Apple,iPhone 13 128 GB 5G 4GB RAM
"Es un producto perfecto, la entrega fue muy r치pida, la calidad es excelente y cumple con lo vendido",5,Apple,iPhone 13 128 GB 5G 4GB RAM
"El color, la calidad de c치mara, la velocidad, la bater칤a.",5,Apple,iPhone 13 128 GB 5G 4GB RAM
Excellent,5,Apple,iPhone 13 128 GB 5G 4GB RAM
Buena calidad,5,Apple,iPhone 13 128 GB 5G 4GB RAM
Exacto lo que quer칤a游땔,5,Apple,iPhone 13 128 GB 5G 4GB RAM
"Muy buena experiencia, lo comprendes desde la p치gina para ir a recogerlo en la tienda, en menos de 3 horas ya ten칤a mi producto. Muy buen servicio.",5,Apple,iPhone 13 128 GB 5G 4GB RAM
El tama침o es genial y hasta ahora me ha resultado excelente,5,Apple,iPhone 13 128 GB 5G 4GB RAM
Excelente producto lo recomiendo,5,Apple,iPhone 13 128 GB 5G 4GB RAM
Producto de excelente calidad. El tama침o es ideal muy c칩modo y la capacidad para almacenar es muy buena.,5,Apple,iPhone 13 128 GB 5G 4GB RAM
Todo perfecto,5,Apple,iPhone 13 128 GB 5G 4GB RAM
Coincide con lo que buscaba,5,Apple,iPhone 13 128 GB 5G 4GB RAM
Excelente producto,5,Apple,iPhone 13 128 GB 5G 4GB RAM
Excelente producto,5,Apple,iPhone 13 128 GB 5G 4GB RAM
Es igual a la foto y hasta ahora es de buena calidad,5,Apple,iPhone 13 128 GB 5G 4GB RAM
Relaci칩n calidad / precio es muy buena,5,Apple,iPhone 13 128 GB 5G 4GB RAM
El tama침o y el dise침o es igual a la foto promocional y de excelente calidad,5,Apple,iPhone 13 128 GB 5G 4GB RAM
Muy buena,5,Apple,iPhone 13 128 GB 5G 4GB RAM
Excelente,5,Apple,iPhone 13 128 GB 5G 4GB RAM
Espectacular,5,Apple,iPhone 13 128 GB 5G 4GB RAM
excelente calidad,5,Apple,iPhone 13 128 GB 5G 4GB RAM
Excelente producto,5,Apple,iPhone 13 128 GB 5G 4GB RAM
"Excelente calidad, enamorado de Iphone",5,Apple,iPhone 13 128 GB 5G 4GB RAM
Es igual a las caracter칤sticas mostradas en la pagina,5,Apple,iPhone 13 128 GB 5G 4GB RAM
El tama침o y dise침칩,5,Apple,iPhone 13 128 GB 5G 4GB RAM
Hermoso y barato,5,Apple,iPhone 13 128 GB 5G 4GB RAM
"Buen tel칠fono, la entrega r치pida y garantizada! Lo mejor al mejor precio",5,Apple,iPhone 13 128 GB 5G 4GB RAM
Igual a la foto y justamente como lo ped칤,5,Apple,iPhone 13 128 GB 5G 4GB RAM
Buen tel칠fono,5,Apple,iPhone 13 128 GB 5G 4GB RAM
"Buena calidad, producto igual al de la foto",5,Apple,iPhone 13 128 GB 5G 4GB RAM
"Excelente por calidad y precio, entrega cumpli칩 con lo tiempos",5,Apple,iPhone 13 128 GB 5G 4GB RAM
"Un producto acorde a la descripci칩n, hermoso color y funcionalidad.",5,Apple,iPhone 13 128 GB 5G 4GB RAM
Excelente calidad y tal cual en las im치genes,5,Apple,iPhone 13 128 GB 5G 4GB RAM
No tengo queja de la marca soy usuario desde el 2014,5,Apple,iPhone 13 128 GB 5G 4GB RAM
"Facilidad de instalaci칩n, presentaci칩n, color",5,Apple,iPhone 13 128 GB 5G 4GB RAM
No hay mucha diferencia entre el iPhone 14 y hasta el momento ha cumplido todas las expectativas,5,Apple,iPhone 13 128 GB 5G 4GB RAM
Todo igual seg칰n referencias de la p치gina y de muy buena calidad,5,Apple,iPhone 13 128 GB 5G 4GB RAM
"Tiene un buen dise침o y es ligero, lastima que no tiene el cargador",5,Apple,iPhone 13 128 GB 5G 4GB RAM
Es Excel producto,5,Apple,iPhone 13 128 GB 5G 4GB RAM
"Hermoso, excelentes caracter칤sticas",5,Apple,iPhone 13 128 GB 5G 4GB RAM
Lo mejor de lo mejor!! Lo que esperaba y el color me encant칩!,5,Apple,iPhone 13 128 GB 5G 4GB RAM
Buena calidad,5,Apple,iPhone 13 128 GB 5G 4GB RAM
Es de exelente calidad,5,Apple,iPhone 13 128 GB 5G 4GB RAM
Es de buena calidad !,5,Apple,iPhone 13 128 GB 5G 4GB RAM
Excelente servicio,5,Apple,iPhone 13 128 GB 5G 4GB RAM
"Pague m치s por llegada r치pida y se demoro 6 d칤as en la entrega, pero el producto excelente",5,Apple,iPhone 13 128 GB 5G 4GB RAM
Es igual a la foto Buena calidad,5,Apple,iPhone 13 128 GB 5G 4GB RAM
Excelente producto,5,Apple,iPhone 13 128 GB 5G 4GB RAM
Llego en el tiempo prometido,5,Apple,iPhone 13 128 GB 5G 4GB RAM
"producto de calidad toma excelentes fotos, f치cil de manejar se siente la calidad",5,Apple,iPhone 13 128 GB 5G 4GB RAM
Todo perfecto,5,Apple,iPhone 13 128 GB 5G 4GB RAM
"Todo con el celular por el momento bien, lo 칰nico malo fue el m칠todo de compra, el env칤o un poco costoso y pues que no se pod칤a recoger en un centro comercial cercano",4,Apple,iPhone 13 128 GB 5G 4GB RAM
Excelente,4,Apple,iPhone 13 128 GB 5G 4GB RAM
Como lo vi en la foto me gusto mucho,4,Apple,iPhone 13 128 GB 5G 4GB RAM
Es el mismo que se ve en fotos.,4,Apple,iPhone 13 128 GB 5G 4GB RAM
Es todo igual tal cual como decia la informaci칩n,4,Apple,iPhone 13 128 GB 5G 4GB RAM
Si es igual,4,Apple,iPhone 13 128 GB 5G 4GB RAM
Si es igual a la foto,4,Apple,iPhone 13 128 GB 5G 4GB RAM
"Igual al de la foto y es de buena calidad, sin embargo, la bater칤a es muy mala para ser un celular nuevo",4,Apple,iPhone 13 128 GB 5G 4GB RAM
"Buen producto , tama침o real ,",4,Apple,iPhone 13 128 GB 5G 4GB RAM
Buen tama침o y calidad,3,Apple,iPhone 13 128 GB 5G 4GB RAM
"Cuando solicite el producto ped칤 el color de la sugerencia (VERDE), y escrib칤 enseguida a un asesor para cambiarlo por rosa, y resulta que me ped칤an cancelar la compra, para hacer nuevamente el pedido, me parece muy obsoleto su sistema en cuanto a eso.",3,Apple,iPhone 13 128 GB 5G 4GB RAM
"No es de buena calidad, sali칩 da침ado de fabrica El producto est치 en garant칤a",1,Apple,iPhone 13 128 GB 5G 4GB RAM
Corresponde y es igual a la descripci칩n:),5,Apple,iPhone 15 128GB 5G 6GB RAM
Excelente,5,Apple,iPhone 15 128GB 5G 6GB RAM
"Excelente producto, buena calidad, acorde a lo pactado",5,Apple,iPhone 15 128GB 5G 6GB RAM
"Es lo que quer칤a , lo necesitaba para mi trabajo, estoy feliz!!!",5,Apple,iPhone 15 128GB 5G 6GB RAM
Perfecto tama침o. Buen producto,5,Apple,iPhone 15 128GB 5G 6GB RAM
"Es lo que quer칤a , lo necesitaba para mi trabajo, estoy feliz!!!",5,Apple,iPhone 15 128GB 5G 6GB RAM
Perfecto tama침o. Buen producto,5,Apple,iPhone 15 128GB 5G 6GB RAM
Excelente servicio,5,Apple,iPhone 15 128GB 5G 6GB RAM
"Muy buen telefono, hasta el momento no he tenido ningun problema de funcionamiento. El despacho fue super rapido",5,Apple,iPhone 15 128GB 5G 6GB RAM
Cumple todas mis espectativas,5,Apple,iPhone 15 128GB 5G 6GB RAM
La descripci칩n corresponde totalmente al producto Excelente servicio y rapidez,5,Apple,iPhone 15 128GB 5G 6GB RAM
"Excelente tama침o , resoluci칩n de pantalla y c치mara",5,Apple,iPhone 15 128GB 5G 6GB RAM
"Divino, el vidrio de atr치s es mate, no brillante como las versiones anteriores",5,Apple,iPhone 15 128GB 5G 6GB RAM
Excelente buen porte y es como lo de la foto,5,Apple,iPhone 15 128GB 5G 6GB RAM
"Excelente servicio, buen producto, lleg칩 en el tiempo establecido",5,Apple,iPhone 15 128GB 5G 6GB RAM
Es igual a la foto y muy buena calidad hasta el momento,5,Apple,iPhone 15 128GB 5G 6GB RAM
"Es igual a la fotos, la entrega fue muy r치pida. Espero que dure mucho 游봃",5,Apple,iPhone 15 128GB 5G 6GB RAM
"Muy f치cil de activar, no se demoro en cargar los datos de mi antiguo iPhone. Muy feliz con mi compra",5,Apple,iPhone 15 128GB 5G 6GB RAM
"Encantado, es muy r치pido y siento que todo es m치s eficiente, celular muy bonito y c칩modo de uso, espero tenerlo mucho tiempo.",5,Apple,iPhone 15 128GB 5G 6GB RAM
"me encanto el dise침o y el tama침o, ademas este es el segundo iphone 15 que compro en falabella",5,Apple,iPhone 15 128GB 5G 6GB RAM
Claro mismo tama침o misma foto etc,5,Apple,iPhone 15 128GB 5G 6GB RAM
Perfecto todo,5,Apple,iPhone 15 128GB 5G 6GB RAM
Excelente,5,Apple,iPhone 15 128GB 5G 6GB RAM
"Algo m치s que espectacular, hac칤a rato no actualizaba mi iPhone y esta fue la mejor decisi칩n, adem치s que el precio estuvo espectacular 游땘",5,Apple,iPhone 15 128GB 5G 6GB RAM
Fecha exacta de env칤o,5,Apple,iPhone 15 128GB 5G 6GB RAM
"No he tenido ning칰n problema, cumpli칩 mis expectativas salte del iPhone 13 al 15 y se nota una diferencia, me encanta la bater칤a y llego s칰per r치pido, ven칤a bien empaquetado, f치cil de comprar hasta hora me ha gustado mucho y el color es precioso tal cual la foto",5,Apple,iPhone 15 128GB 5G 6GB RAM
"Lo compr칠 para regalar, no soy experto pero mi hija est치 feliz",5,Apple,iPhone 15 128GB 5G 6GB RAM
"Genial, todo perfecto",5,Apple,iPhone 15 128GB 5G 6GB RAM
"Tras usar un iPhone Xr por 5 a침os, actualic칠 al 15 y el cambio es muy notorio. Aparte de que el tel칠fono es m치s c칩modo para manipular, es mucho m치s r치pido en todas sus funciones.",5,Apple,iPhone 15 128GB 5G 6GB RAM
Excelente,5,Apple,iPhone 15 128GB 5G 6GB RAM
"Es igua al de la foto, de muy buena calidad, toma fotos muy nitidas",5,Apple,iPhone 15 128GB 5G 6GB RAM
Es de los mejores,5,Apple,iPhone 15 128GB 5G 6GB RAM
Se ajusta a las especificaciones dadas en Falabella,5,Apple,iPhone 15 128GB 5G 6GB RAM
"Compra r치pida , llego antes de tiempo",5,Apple,iPhone 15 128GB 5G 6GB RAM
Hermoso diae침o y liviano,5,Apple,iPhone 15 128GB 5G 6GB RAM
Cumple todas las expectativas,5,Apple,iPhone 15 128GB 5G 6GB RAM
"Es perfecto, me encant칩 el color rosa y el tama침o. El material lo hace ser muy ligero.",5,Apple,iPhone 15 128GB 5G 6GB RAM
Comprar un iphone es ir a la fija!,5,Apple,iPhone 15 128GB 5G 6GB RAM
Lleg칩 en buen estado es igual a la foto el tama침o corresponde,5,Apple,iPhone 15 128GB 5G 6GB RAM
"Llego en el tiempo establecido, la c치mara es una maravilla, me gust칩 mucho, estoy muy a gusto con mi compra 九뻟릦",5,Apple,iPhone 15 128GB 5G 6GB RAM
"Excelente, s칰per liviano",5,Apple,iPhone 15 128GB 5G 6GB RAM
"Divino el dise침o , muy funcional y r치pido",5,Apple,iPhone 15 128GB 5G 6GB RAM
Muy buen celular,5,Apple,iPhone 15 128GB 5G 6GB RAM
Es bueno,5,Apple,iPhone 15 128GB 5G 6GB RAM
"Excelente producto, igual a la foto.",5,Apple,iPhone 15 128GB 5G 6GB RAM
"El mismo, excelente calidad",5,Apple,iPhone 15 128GB 5G 6GB RAM
Todo son sin novedad,5,Apple,iPhone 15 128GB 5G 6GB RAM
Justo lo que se esperaba,5,Apple,iPhone 15 128GB 5G 6GB RAM
Es lo que esperaba,4,Apple,iPhone 15 128GB 5G 6GB RAM
"Me llego el producto a tiempo, solo que llego la caja del celular toda sucia. Esperemos que el funcionamiento el equipo sea bueno.",4,Apple,iPhone 15 128GB 5G 6GB RAM
"Me gust칩 mucho la calidad, el tama침o es perfecto",4,Apple,iPhone 15 128GB 5G 6GB RAM
"Lindo modelo, eficaz como el anterior iPhone 12 que ten칤a pero debo decir que esperaba m치s de la c치mara y siento que no es mucha la diferencia entre mi antiguo celular y este 칰ltimo modelo, la 칰nica diferencia es que puedes editar la foto y difuminar el fondo sin tanta complicaci칩n. La bater칤a tampoco es la gran maravilla , as칤 que en conclusi칩n es muy muy muy similiar al cualquier otro de los anteriores iPhone",4,Apple,iPhone 15 128GB 5G 6GB RAM
Igual a la foto! Ideal,4,Apple,iPhone 15 128GB 5G 6GB RAM
Si est치 bien corresponde a la publicidad,4,Apple,iPhone 15 128GB 5G 6GB RAM
Me parecio prque침o,3,Apple,iPhone 15 128GB 5G 6GB RAM
Si es igual al picture de la publicidad,3,Apple,iPhone 15 128GB 5G 6GB RAM
El equipo lo lleve por garant칤a porque no carga bien,1,Apple,iPhone 15 128GB 5G 6GB RAM
"Para la Plata que se paga , almenos no me llego con cargador tampoco Chip !",1,Apple,iPhone 15 128GB 5G 6GB RAM
"Recib칤 mi celular es perfecta condiciones, abr칤 prob칠 todo antes de retirarme de la tienda",5,Apple,iPhone 15 128GB 5G 6GB RAM
"Igualito a la foto, aunque es persona es m치s bello 驕쥞잺",5,Apple,iPhone 15 128GB 5G 6GB RAM
Es de muy buena calidad y cumple con las especificaciones que decia,5,Apple,iPhone 15 128GB 5G 6GB RAM
Es una buena decisi칩n de compra si quieres funcionalidad y garant칤a de buen rendimiento. Recomendado,5,Apple,iPhone 15 128GB 5G 6GB RAM
"Me cambi칠 de Android a IPhone y la verdad que bastante bien, al principio cuesta un poco. El celular cumple con todas las caracter칤sticas mencionadas, solo que no incluye el enchufe para el cargador, es f치cil de sincronizar con parlantes, aud칤fonos y relojes aunque no sean de la marca, la bater칤a me dura casi todo el d칤a us치ndolo mayormente en redes sociales y Spotify, hasta el momento la diferencia de duraci칩n ser치 en promedio de unas 6 horas comparadas con la bater칤a de mi antiguo celular Android, por lo dem치s me va excelente.",5,Apple,iPhone 15 128GB 5G 6GB RAM
Lindo color tama침o perfecto,5,Apple,iPhone 15 128GB 5G 6GB RAM
Es una buena decisi칩n de compra si quieres funcionalidad y garant칤a de buen rendimiento. Recomendado,5,Apple,iPhone 15 128GB 5G 6GB RAM
"Me cambi칠 de Android a IPhone y la verdad que bastante bien, al principio cuesta un poco. El celular cumple con todas las caracter칤sticas mencionadas, solo que no incluye el enchufe para el cargador, es f치cil de sincronizar con parlantes, aud칤fonos y relojes aunque no sean de la marca, la bater칤a me dura casi todo el d칤a us치ndolo mayormente en redes sociales y Spotify, hasta el momento la diferencia de duraci칩n ser치 en promedio de unas 6 horas comparadas con la bater칤a de mi antiguo celular Android, por lo dem치s me va excelente.",5,Apple,iPhone 15 128GB 5G 6GB RAM
Lindo color tama침o perfecto,5,Apple,iPhone 15 128GB 5G 6GB RAM
"Es igual al producto mostrado en la foto, retire en tienda de manera expedita y el mismo d칤a que gener칠 la compra. El equipo es exactamente igual a lo descrito. De su funcionamiento no tengo mucho que decir porque estoy reci칠n aprob치ndolo, pero en caso de cualquier cosa tiene su garant칤a de compra.",5,Apple,iPhone 15 128GB 5G 6GB RAM
Todo incre칤ble,5,Apple,iPhone 15 128GB 5G 6GB RAM
"Producto de buena calidad, buen sistema operativo y muy simple de utilizar.",5,Apple,iPhone 15 128GB 5G 6GB RAM
"Es igual al equipo que necesitaba, fotos claras, me sirve en mi trabajo.",5,Apple,iPhone 15 128GB 5G 6GB RAM
Excelente telefono,5,Apple,iPhone 15 128GB 5G 6GB RAM
"igual a la foto, excelente",5,Apple,iPhone 15 128GB 5G 6GB RAM
Todo corresponde a lo publicado,5,Apple,iPhone 15 128GB 5G 6GB RAM
Todo corresponde a lo esperado,5,Apple,iPhone 15 128GB 5G 6GB RAM
"C치mara excelente sabiendo usarla y configurar, equipo ligero y est칠ticamente lindo. Funcionamiento impecable con 칰ltima actualizaci칩n de iOS.",5,Apple,iPhone 15 128GB 5G 6GB RAM
"Excelente producto, ha funcionado super bien,vale la pena la inversi칩n",5,Apple,iPhone 15 128GB 5G 6GB RAM
