comentario,calificacion,marca,modelo
(Esta rese침a se ha recibido a trav칠s de una promoci칩n.) Adquir칤 este cel y me ha encantado muchas gracias SAMSUNG,5,Samsung,Samsung A15 256GB
(Esta rese침a se ha recibido a trav칠s de una promoci칩n.) Bueno y duraci칩n de bater칤a es excelente para el uso diario.,5,Samsung,Samsung A15 256GB
"(Esta rese침a se ha recibido a trav칠s de una promoci칩n.) Aun conoci칠ndolo, pero hasta el momento el rendimiento va full.",5,Samsung,Samsung A15 256GB
Hola compre este producto A15 y es muy bueno de se침al,5,Samsung,Samsung A15 256GB
"100% recomendado,es r치pido, tiene buena c치mara y dura mucho la bater칤a.",5,Samsung,Samsung A15 256GB
"Equipo cumple con las expectativas, es comodo y lindo",5,Samsung,Samsung A15 256GB
"Llevo 2 semanas con 칠l, cumple con lo que dice en la descripci칩n, y por el precio es un buen producto",5,Samsung,Samsung A15 256GB
lo compre hace una semana y me encanta es muy rapido y la camara e super excelente la mejor la imagen super el sonido es espectacular me encanta lo recomiendo,5,Samsung,Samsung A15 256GB
Muy bueno. Me gusta. Gracias samsung por ese dise침o tan lindo,5,Samsung,Samsung A15 256GB
"Excelente equipo, hasta ahora cumple con mis expectativas, es super veloz",5,Samsung,Samsung A15 256GB
Compre este producto to hace 10 d칤a y me parece super,5,Samsung,Samsung A15 256GB
"Lo compre hace diez d칤as y estoy feliz con el, me hace la vida mas f치cil al poder controlar otros dispositivos con el",5,Samsung,Samsung A15 256GB
Lo compre porque quer칤a un Samsung. Tuve un s9 plus y tuve problemas por imei duplicado. Y quise reemplazar por otro equipo de la marca,5,Samsung,Samsung A15 256GB
Muy buen equipo muy amigable con excelentes desempe침os,5,Samsung,Samsung A15 256GB
(Esta rese침a se ha recibido a trav칠s de una promoci칩n.) El producto el bueno y el dise침o excelente solo faltar칤a flash frontal,4,Samsung,Samsung A15 256GB
"Le doy 4 por que apenas y llevo un dia con el, hasta el momento me parece muy rapida la carga me sorprendio",4,Samsung,Samsung A15 256GB
(Esta rese침a se ha recibido a trav칠s de una promoci칩n.) Compre este producto hace poco y aparentemente sus funciones son como las dice en su caracter칤stica,4,Samsung,Samsung A15 256GB
"(Esta rese침a se ha recibido a trav칠s de una promoci칩n.) Lo compre hace aproximado un mes, funciona muy bien y es bastante agradable est칠ticamente.",4,Samsung,Samsung A15 256GB
(Esta rese침a se ha recibido a trav칠s de una promoci칩n.) Compre mi equipo hace 13 d칤a y hasta el momento me esta funcionando a la perfeccoon,4,Samsung,Samsung A15 256GB
"Llevo tres semanas con este celular y hasta el momento todo ha funcionado bien, lo 칰nico que me parece malo es que vendan el cargador por separado (uno no puede derrotar a la competencia ""游꼝"" haciendo lo mismo que la competencia)",4,Samsung,Samsung A15 256GB
"Llevo menos de una semana con el equipo es excelente su rendimiento, es espectacular su dise침o, lo he ido explorando y me gusta pero; he encontrado cosas que no me gustan como: 1 no trae cargador 2 la c치mara es muy b치sica, no tiene forma de hacer dual c치mara o variedad de tipo de video como r치pida, tipo vlog, entre otros. 3 no tiene la opci칩n para tomar fotos tipo documento scaner.",4,Samsung,Samsung A15 256GB
"Amo el celular me encanta su avance... Siempre he elegido la marca samsung, como muchos lo hacemos lo realmente malo y que disgusta mucho es que los celulares no incluyan cargadores y toque comprarlos por separado porque as칤 nos exponemos a comprar algun cargador no original por el valor de uno origina ya que muchos no sabemos diferenciar el cargador original. LOS AMOOO PERO SIGAN INCLUYENDO LOS CARGADORES POR FAAAAAAAVOOOOOOR",3,Samsung,Samsung A15 256GB
"El telefono se acopla a lo basico, aunque se queda corto en la fotografia y grabaci칩n de video, le falta sonido dolby, la carga es algo lenta... De resto el telefono funciona bien el g99 esta bien optimizado.",3,Samsung,Samsung A15 256GB
"Sucede que este celular se enloquece solo, lo coloco en mi bolso de mano (cartera) o en el bolsillo dentro de mi pantal칩n e inmediatamente comienza a mover solo la pantalla, se bloquea la pantalla sola, se abren las aplicaciones solas, mensajes, fotos, todo. El solo celular hace de todo y dura as칤 un largo tiempo y ni poderlo reiniciar en algunos casos me deja porque no coge mis dedos como t치ctil as칤 que solo puedo dejarlo quieto en una superficie hasta que est칠 normal y me deje usarlo. 쯈u칠 soluci칩n me dan para este celular? Resalto que tiene un mes de comprado de su propia tienda f칤sica ac치 en la ciudad de Ibagu칠, Tolima, Colombia. Es como si tuviera un defecto de fabricaci칩n con respecto a su funcionamiento operativo en el aspecto del display, algo de la pantalla. Agradezco su pronta soluci칩n, conf칤o en que me dar치n soluci칩n ya que siempre he sido usuaria Samsumg y sus productos nunca me hab칤an salido con una falla como esta",2,Samsung,Samsung A15 256GB
(Esta rese침a se ha recibido a trav칠s de una promoci칩n.),5,Samsung,Samsung A15 256GB
"(Esta rese침a se ha recibido a trav칠s de una promoci칩n.) estoy muy satisfecho con este telefono y su rendimiento. La pantalla es impresionante, con colores vivos y claridad excepcional. La c치mara es excelente, captura momentos con detalles incre칤bles aunque no es que me gustan las fotos pero las camras son muy elegantes . El procesador es r치pido y fluido, sin lag ni problemas. Muy buena la bateria carga ultrarapida pero eso si tienen q escojer un cargador adecuado para eso, yo creeria que el de 25w esta bien La calidad de sonido es excelente, tienen muy buen altavoz tanto en llamadas, alarmas como en reproducci칩n de m칰sica. Recomiendo ampliamente este dispositivo a cualquier persona que busque un tel칠fono fiable y potente.",5,Samsung,Samsung A15 256GB
"(Esta rese침a se ha recibido a trav칠s de una promoci칩n.) Compre elmi tel칠fono a 15 y es espectacular , 游녧 游땘",5,Samsung,Samsung A15 256GB
COMPRE ESTEPRODUCTO HACE APROXIMADAMENTE TRES (03) MESES,5,Samsung,Samsung A15 256GB
Me encanta este producto tengo 15 d칤as que lo compre,5,Samsung,Samsung A15 256GB
"Lo compre hace poco y en general funciona bien, me parece buen equipo",5,Samsung,Samsung A15 256GB
COMPRE ESTEPRODUCTO HACE APROXIMADAMENTE TRES (03) MESES,5,Samsung,Samsung A15 256GB
Me encanta este producto tengo 15 d칤as que lo compre,5,Samsung,Samsung A15 256GB
"Lo compre hace poco y en general funciona bien, me parece buen equipo",5,Samsung,Samsung A15 256GB
Llevo 1 mes con el y me gusta espero sea genial por mucho tiempo,5,Samsung,Samsung A15 256GB
"(Esta rese침a se ha recibido a trav칠s de una promoci칩n.) Exelente el sistema operativo, el dise침o muy lindo",5,Samsung,Samsung A15 256GB
"(Esta rese침a se ha recibido a trav칠s de una promoci칩n.) El celular es muy completo, sus actualizaciones son extremadamente lindas.",5,Samsung,Samsung A15 256GB
Este mes lo compre y me gust칩 mucho f치cil de manejar.,5,Samsung,Samsung A15 256GB
"(Esta rese침a se ha recibido a trav칠s de una promoci칩n.) Me encant칩 es r치pido, f치cil manejo ,me encanta la c치mara",5,Samsung,Samsung A15 256GB
(Esta rese침a se ha recibido a trav칠s de una promoci칩n.) Me gusto es un recurso tecnol칩gico y es muy bueno por que no ocupa mucho espacio,5,Samsung,Samsung A15 256GB
"Excelente producto muy confiable, me gustan sus colores",5,Samsung,Samsung A15 256GB
(Esta rese침a se ha recibido a trav칠s de una promoci칩n.) Adquir칤 este cel y me ha encantado muchas gracias SAMSUNG,5,Samsung,Samsung A15 256GB
(Esta rese침a se ha recibido a trav칠s de una promoci칩n.) Bueno y duraci칩n de bater칤a es excelente para el uso diario.,5,Samsung,Samsung A15 256GB
"(Esta rese침a se ha recibido a trav칠s de una promoci칩n.) Aun conoci칠ndolo, pero hasta el momento el rendimiento va full.",5,Samsung,Samsung A15 256GB
Hola compre este producto A15 y es muy bueno de se침al,5,Samsung,Samsung A15 256GB
"100% recomendado,es r치pido, tiene buena c치mara y dura mucho la bater칤a.",5,Samsung,Samsung A15 256GB
"Equipo cumple con las expectativas, es comodo y lindo",5,Samsung,Samsung A15 256GB
"Llevo 2 semanas con 칠l, cumple con lo que dice en la descripci칩n, y por el precio es un buen producto",5,Samsung,Samsung A15 256GB
lo compre hace una semana y me encanta es muy rapido y la camara e super excelente la mejor la imagen super el sonido es espectacular me encanta lo recomiendo,5,Samsung,Samsung A15 256GB
Muy bueno. Me gusta. Gracias samsung por ese dise침o tan lindo,5,Samsung,Samsung A15 256GB
"Excelente equipo, hasta ahora cumple con mis expectativas, es super veloz",5,Samsung,Samsung A15 256GB
Compre este producto to hace 10 d칤a y me parece super,5,Samsung,Samsung A15 256GB
"Lo compre hace diez d칤as y estoy feliz con el, me hace la vida mas f치cil al poder controlar otros dispositivos con el",5,Samsung,Samsung A15 256GB
Lo compre porque quer칤a un Samsung. Tuve un s9 plus y tuve problemas por imei duplicado. Y quise reemplazar por otro equipo de la marca,5,Samsung,Samsung A15 256GB
Muy buen equipo muy amigable con excelentes desempe침os,5,Samsung,Samsung A15 256GB
(Esta rese침a se ha recibido a trav칠s de una promoci칩n.) El producto el bueno y el dise침o excelente solo faltar칤a flash frontal,4,Samsung,Samsung A15 256GB
"Le doy 4 por que apenas y llevo un dia con el, hasta el momento me parece muy rapida la carga me sorprendio",4,Samsung,Samsung A15 256GB
(Esta rese침a se ha recibido a trav칠s de una promoci칩n.) Compre este producto hace poco y aparentemente sus funciones son como las dice en su caracter칤stica,4,Samsung,Samsung A15 256GB
Me gustaria un manual para aprender a sacarle el mayor provecho o al menos un video en youtube como instructivo.,4,Samsung,Samsung A15 256GB
(Esta rese침a se ha recibido a trav칠s de una promoci칩n.) Lo adquir칤 hace dos meses y tuve que devolverlo por garant칤a llevo un mes esperando a que me lo devuelvan pero en si es un celular muy bueno y me encanta su c치mara,4,Samsung,Samsung A15 256GB
Equipo muy completo y adsequible con un precio muy ganador,4,Samsung,Samsung A15 256GB
"Hace 1 semana lo tengo, r치pido envio y el equipo es muy buen calidad precio, c치maras decentes y con un rendimiento m치s que aceptable para el d칤a de hoy, como punto negativo le doy el dise침o de la pantalla con bordes grandes y c치mara notch tipo gota anticuado para cualquier m칩vil del momento, en general es muy buen equipo al mejor precio.",4,Samsung,Samsung A15 256GB
"Compr칠 este producto el 11 de octubre para reponer un Samsung galaxy J8 que me fue hurtado despu칠s de 6 a침os, extra침o mucho ese equipo, adem치s el A15 ha presentado fallas como: - En 4 o 5 ocasiones las llamadas se han tenido que repetir porque del otro lado no me escuchan. - A una semana de haber comenzado presento la pantalla titilante y pasaba de una a otra app y no permit칤a reiniciar ni apagar. - El cable que viene con el equipo no recarga en el carro aun conectandolo a un adaptador nuevo.",3,Samsung,Samsung A15 256GB
"Compr칠 Galaxy A15 bien dise침o, buena memoria y buena bater칤a, sin embargo, por momentos el equipo se pone lento.",3,Samsung,Samsung A15 256GB
"Ya el equipo lo conozco, es un muy buen tel칠fono y lo recomiendo, pero a mi no me lleg칩 el cargador, desde la tienda normal todo en orden, se agrega el carrito y los precios se actualizan, pero en la tienda de estudiantes no se actualizaban los precios y el enlace para leer los t칠rminos estaba roto, ya hable con soporte, si se resuelve le pondr칠 las 5 estrellas porque es normal que un una app hayan errores cada tanto y el equipo fue muy amable conmigo 游땕 Intent칠 agregar im치genes, pero al darle al bot칩n no hac칤a nada, y si estaba cargando tardaba mucho 游땐",2,Samsung,Samsung A15 256GB
"Lo compre y muy lento. No me gusto, ademas primera caida que tuvony se partio todito",1,Samsung,Samsung A15 256GB
"(Esta rese침a se ha recibido a trav칠s de una promoci칩n.) Excelente equipo pantalla super amoled, excelente bater칤a dura much칤simo",5,Samsung,Samsung A15 256GB
"(Esta rese침a se ha recibido a trav칠s de una promoci칩n.) Desde que compr칠 mi nuevo celular hace dos semanas, me ha sorprendido su calidad en cada aspecto. La pantalla es incre칤blemente n칤tida; los colores se ven vivos y es f치cil de ver incluso bajo la luz del sol, lo cual agradezco much칤simo. La c치mara tambi칠n ha sido una grata sorpresa, capturando fotos claras y con colores que se ven muy naturales. La bater칤a dura much칤simo, lo que me permite usar el celular sin preocuparme por estar buscando un enchufe todo el tiempo. En resumen, siento que hice una gran inversi칩n con este celular. Es una herramienta confiable y de alta calidad que me ha dado justo lo que necesitaba para mi d칤a a d칤a.",5,Samsung,Samsung A15 256GB
(Esta rese침a se ha recibido a trav칠s de una promoci칩n.) Compre este celular hace 1 semana y me encanta cumple mis espectativas me encamta su camara y su calidez de fps,5,Samsung,Samsung A15 256GB
(Esta rese침a se ha recibido a trav칠s de una promoci칩n.) Compre un celular el 3 de septiembre me encanta 游눘,5,Samsung,Samsung A15 256GB
"Compre el a15 4g hace unos d칤as y me encanta buen rendimiento buena bater칤a, pantalla superior recomendado",5,Samsung,Samsung A15 256GB
"Este producto lo adquir칤 hace ya un mes y estoy satisfecho, me ha gustado",5,Samsung,Samsung A15 256GB
(Esta rese침a se ha recibido a trav칠s de una promoci칩n.) Compre un celular el 3 de septiembre me encanta 游눘,5,Samsung,Samsung A15 256GB
"Compre el a15 4g hace unos d칤as y me encanta buen rendimiento buena bater칤a, pantalla superior recomendado",5,Samsung,Samsung A15 256GB
"Este producto lo adquir칤 hace ya un mes y estoy satisfecho, me ha gustado",5,Samsung,Samsung A15 256GB
"(Esta rese침a se ha recibido a trav칠s de una promoci칩n.) Buen producto, excelente calidad. Buena c치mara, r치pido y con buena memoria.",5,Samsung,Samsung A15 256GB
Buenas tardes. Muy buen celular. Pero no me enviaron la factura y la necesto.Me pueden ayudar con esto por favor. Gracias.,5,Samsung,Samsung A15 256GB
"(Esta rese침a se ha recibido a trav칠s de una promoci칩n.) Lo tengo hace una semana y funciona muy bien, la bater칤a tambi칠n, solo lo cargo una vez al d칤a y pues no juego mucho as칤 que los juegos corren bien",5,Samsung,Samsung A15 256GB
(Esta rese침a se ha recibido a trav칠s de una promoci칩n.) Me encant칩 este producto por que es barato y tiene un espacio y c치mara espectacular,5,Samsung,Samsung A15 256GB
(Esta rese침a se ha recibido a trav칠s de una promoci칩n.) Lo compre hace dos semanas y me ha salido muy bueno,5,Samsung,Samsung A15 256GB
(Esta rese침a se ha recibido a trav칠s de una promoci칩n.) Compre un celular la semana pasada y ah sido la mejor compra del a침o,5,Samsung,Samsung A15 256GB
Es muy bueno y f치cil de usar Adem치s tiene una buena capacidad de almacenamiento,5,Samsung,Samsung A15 256GB
"(Esta rese침a se ha recibido a trav칠s de una promoci칩n.) Llevo un tiempo usando el Samsung Galaxy A15 y, en general, mi experiencia ha sido bastante positiva. Lo que m치s me ha sorprendido de este tel칠fono es su rapidez y fluidez. A pesar de ser un modelo accesible, responde muy bien a las tareas diarias. Navegar entre aplicaciones, enviar mensajes, e incluso usar varias apps a la vez, todo fluye sin demoras notables.",5,Samsung,Samsung A15 256GB
Compre este celular ase poco y todo a sido muy bueno,5,Samsung,Samsung A15 256GB
"(Esta rese침a se ha recibido a trav칠s de una promoci칩n.) Muy r치pido, buena c치mara, los colores son lindos...",5,Samsung,Samsung A15 256GB
Lo compre ayer me salio muy bueno quisiera saber si tiene gorilla glass,5,Samsung,Samsung A15 256GB
Demasiado intuitivo pr치ctico y vers치til Todo lo que quiero m치s todo lo que necesito,5,Samsung,Samsung A15 256GB
"Tengo el dispositivo desde hace casi un a침o, es un dispositivo que para su precio ofrece muy buenas caracter칤sticas, su c치mara es muy buena, su dise침o y materiales son hermosos.",5,Samsung,Samsung A15 256GB
Para el precios es muy buen producto ya llevo 15 d칤as de uso,5,Samsung,Samsung A15 256GB
"Compr칠 el equipo el mes pasado, buena relacion calidad precio. Excelente inversion si deseas un celular de calidad y bonito a un precio asequible.",5,Samsung,Samsung A15 256GB
Tengo un mes con el celular y me parece excelente,5,Samsung,Samsung A15 256GB
"Excelente equipo, m치s de lo que imaginaba a un buen precio.",5,Samsung,Samsung A15 256GB
lo compre el mes pasado y me parese jenial navega muy bien,5,Samsung,Samsung A15 256GB
Compre el producto el mes pasado y me parece muy bueno,5,Samsung,Samsung A15 256GB
"Lo compr칠 hace dos semanas y me encanta, excelente :D Siempre Team Samsung <3",5,Samsung,Samsung A15 256GB
Para el precio creo que es el mejor y tiene cualidades de tel칠fonos m치s costosos en definitiva una muy buena compra,5,Samsung,Samsung A15 256GB
Compre este producto el mes pasado y me a salido muy bueno,4,Samsung,Samsung A15 256GB
calidad samsung conocida desde hace muchos a침os ...,4,Samsung,Samsung A15 256GB
Siempre he sido usuario de samsung desde hace unos 20 a침os teniendo varios modelos de celulares y en esta ocasi칩n no es la excepci칩n con este celular ya que aunque es una gama m치s sencilla que los q he tenido sigue sorprendiendo con su rendimiento y la calidad de su camaras,4,Samsung,Samsung A15 256GB
"(Esta rese침a se ha recibido a trav칠s de una promoci칩n.) Lo compre hace aproximado un mes, funciona muy bien y es bastante agradable est칠ticamente.",4,Samsung,Samsung A15 256GB
(Esta rese침a se ha recibido a trav칠s de una promoci칩n.) Compre mi equipo hace 13 d칤a y hasta el momento me esta funcionando a la perfeccoon,4,Samsung,Samsung A15 256GB
"Llevo tres semanas con este celular y hasta el momento todo ha funcionado bien, lo 칰nico que me parece malo es que vendan el cargador por separado (uno no puede derrotar a la competencia ""游꼝"" haciendo lo mismo que la competencia)",4,Samsung,Samsung A15 256GB
"Llevo menos de una semana con el equipo es excelente su rendimiento, es espectacular su dise침o, lo he ido explorando y me gusta pero; he encontrado cosas que no me gustan como: 1 no trae cargador 2 la c치mara es muy b치sica, no tiene forma de hacer dual c치mara o variedad de tipo de video como r치pida, tipo vlog, entre otros. 3 no tiene la opci칩n para tomar fotos tipo documento scaner.",4,Samsung,Samsung A15 256GB
"Amo el celular me encanta su avance... Siempre he elegido la marca samsung, como muchos lo hacemos lo realmente malo y que disgusta mucho es que los celulares no incluyan cargadores y toque comprarlos por separado porque as칤 nos exponemos a comprar algun cargador no original por el valor de uno origina ya que muchos no sabemos diferenciar el cargador original. LOS AMOOO PERO SIGAN INCLUYENDO LOS CARGADORES POR FAAAAAAAVOOOOOOR",3,Samsung,Samsung A15 256GB
"El telefono se acopla a lo basico, aunque se queda corto en la fotografia y grabaci칩n de video, le falta sonido dolby, la carga es algo lenta... De resto el telefono funciona bien el g99 esta bien optimizado.",3,Samsung,Samsung A15 256GB
"Sucede que este celular se enloquece solo, lo coloco en mi bolso de mano (cartera) o en el bolsillo dentro de mi pantal칩n e inmediatamente comienza a mover solo la pantalla, se bloquea la pantalla sola, se abren las aplicaciones solas, mensajes, fotos, todo. El solo celular hace de todo y dura as칤 un largo tiempo y ni poderlo reiniciar en algunos casos me deja porque no coge mis dedos como t치ctil as칤 que solo puedo dejarlo quieto en una superficie hasta que est칠 normal y me deje usarlo. 쯈u칠 soluci칩n me dan para este celular? Resalto que tiene un mes de comprado de su propia tienda f칤sica ac치 en la ciudad de Ibagu칠, Tolima, Colombia. Es como si tuviera un defecto de fabricaci칩n con respecto a su funcionamiento operativo en el aspecto del display, algo de la pantalla. Agradezco su pronta soluci칩n, conf칤o en que me dar치n soluci칩n ya que siempre he sido usuaria Samsumg y sus productos nunca me hab칤an salido con una falla como esta",2,Samsung,Samsung A15 256GB
(Esta rese침a se ha recibido a trav칠s de una promoci칩n.) Llevo 10 d칤a y me parece genial el movil alta calidad,5,Samsung,Samsung A15 256GB
"Este equipo me dej칩 sin palabras, es m치s de lo que se puede esperar de una gama media como lo es el A15, carga super r치pido, la c치mara es buena Solo tengo una pregunta, el equipo se puede utilizar con carga inalambrica?",5,Samsung,Samsung A15 256GB
"(Esta rese침a se ha recibido a trav칠s de una promoci칩n.) Compre el Samsung Galaxy A15 y es un excelente equipo, me encanta.",5,Samsung,Samsung A15 256GB
"Fue un regalo para mi mam치, se lo compr칠 por los componentes, precio y dise침o. Est치 hermoso, el color es muy lindo, funciona muy bien y ella m치s que contenta.",5,Samsung,Samsung A15 256GB
Buen dise침o Y pantalla muy limpia para los dedos....,5,Samsung,Samsung A15 256GB
"Compre este producto el mes pasado, lo que quer칤a, me encanto",5,Samsung,Samsung A15 256GB
"Fue un regalo para mi mam치, se lo compr칠 por los componentes, precio y dise침o. Est치 hermoso, el color es muy lindo, funciona muy bien y ella m치s que contenta.",5,Samsung,Samsung A15 256GB
Buen dise침o Y pantalla muy limpia para los dedos....,5,Samsung,Samsung A15 256GB
"Compre este producto el mes pasado, lo que quer칤a, me encanto",5,Samsung,Samsung A15 256GB
"Compre el producto hace m치s de 15 d칤as y estoy super contenta ya que es muy bueno,r치pido y 칰til.",5,Samsung,Samsung A15 256GB
"(Esta rese침a se ha recibido a trav칠s de una promoci칩n.) Siempre he usado Samsung, no me cambio a otra marca. Es espectacular!",5,Samsung,Samsung A15 256GB
"Muy buen celular, 치gil y r치pido con funciones espec칤ficas",5,Samsung,Samsung A15 256GB
(Esta rese침a se ha recibido a trav칠s de una promoci칩n.) Lo compre hace poco tiempo y fue una excelente decisi칩n,5,Samsung,Samsung A15 256GB
Lo compr칠 y me parece que es un dispositivo excelente,5,Samsung,Samsung A15 256GB
Compre el celular y me pareci칩 fant치stico buena resoluci칩n de pantalla gran espacio de almacenamiento excelentes c치maras,5,Samsung,Samsung A15 256GB
(Esta rese침a se ha recibido a trav칠s de una promoci칩n.) Es muy bueno Aparte tiene buena ram Buen almacenamiento Y su bater칤a muy buena,5,Samsung,Samsung A15 256GB
Me gusto mucho el dise침o la comodidad de manejarlo y lo actualizado,5,Samsung,Samsung A15 256GB
"(Esta rese침a se ha recibido a trav칠s de una promoci칩n.) Excelente producto, vers치til y r치pido acorde a su precio.",5,Samsung,Samsung A15 256GB
ME ENCANTO EL CELULAR ME LLEGO JUSTO A TIEMPO GRACIAS,5,Samsung,Samsung A15 256GB
Excelente m치quina es uno de los mejores calidad precio del mercado actual.,5,Samsung,Samsung A15 256GB
"Compre este producto la semana pasada y ha llenado todas mis expectativas en cuanto a rendimiento, funcionalidad y bater칤a, todo funciona fluidamente y r치pido como lo esperaba, aclaro que el producto es de 8gb/256gb de almacenamiento.",5,Samsung,Samsung A15 256GB
muy bueno para jugar y Aser cosas b치sicas como hablar por WhatsApp ver videos ets,5,Samsung,Samsung A15 256GB
Tengo mi celular samsung a 15 y me ha gustado. S칰per.,5,Samsung,Samsung A15 256GB
La inagen es espectacular el sonido increible y la camara super,5,Samsung,Samsung A15 256GB
Fue un regalo del d칤a del padre en reemplazo de mi equipo anterior,5,Samsung,Samsung A15 256GB
Compr칠 el tel칠fono hace 15 d칤as y hasta los momentos todo va bien.,5,Samsung,Samsung A15 256GB
Compre el equipo y me encanta es muy funcional acorde a lo que necesito,5,Samsung,Samsung A15 256GB
"Muy buen equipo, me encant칩. Siempre he utilizado Samsunh",5,Samsung,Samsung A15 256GB
"Compr칠 este producto hace unas semanas, me encanta el aspecto que tiene y su rendimiento.",5,Samsung,Samsung A15 256GB
Samsung a15 recomendado realmente es el mejor m칩vil.,5,Samsung,Samsung A15 256GB
"Es muy bueno este Samsung Galaxy A15 5G , su bateria me dura mas de 1 dia , sin duda su punto fuerte , otra caracteristica es el NFC ya que otros telefonos no lo suelen incluir a este precio , por mejorar el rendimiento",4,Samsung,Samsung A15 256GB
Compre este producto el mes pasado y me a gustado mucho,4,Samsung,Samsung A15 256GB
(Esta rese침a se ha recibido a trav칠s de una promoci칩n.) Compre este producto ya hace un mes y me parece muy bueno,4,Samsung,Samsung A15 256GB
(Esta rese침a se ha recibido a trav칠s de una promoci칩n.) Compre este producto hace una semana y me encuentro muy satisfecho es un muy buen aparto con excelentes prestaciones,4,Samsung,Samsung A15 256GB
Le faltar칤a el 5G en pleno 2024 que venga sin 5g es tenaz.,4,Samsung,Samsung A15 256GB
"E comprado el producto ya hace dos semanas , en este lapso de tiempo el producto a funcionado muy bien septo que en juegos llega a calentarce y la bateria no dura mucho que se diga . Aparte de eso el telefono es muy bueno游때游때游때",4,Samsung,Samsung A15 256GB
Compre este celu hace 3 meses y la verdad una pantalla super amoled muy buena full color brillo. Buena c치mara principal pero la frontal las fotos quedan con tus costado de cara al rev칠s. Eso fue lo 칰nico que no me gust칩. El samsung J6 ten칤a mejor c치mara frontal.,3,Samsung,Samsung A15 256GB
(Esta rese침a se ha recibido a trav칠s de una promoci칩n.) Compr칠 el celular el 6 de septiembre 2024 San pablo,3,Samsung,Samsung A15 256GB
"(Esta rese침a se ha recibido a trav칠s de una promoci칩n.) No cumple con expectativas de tecnol칩gicas en comparaci칩n con sus competidores, no trae el cargador que garantiza el correcto funcionamiento de la bater칤a.",2,Samsung,Samsung A15 256GB
