comentario,calificacion,marca,modelo
"Compr칠 el producto y la verdad es fenomenal, c치mara so침ada, el Pen siempre me ha acompa침ado desde el Note 10. 游땘",5,Samsung,Samsung S24 Ultra 256GB 12GB
Es el mejor tel칠fono que he tenido la experiencia insuperable,5,Samsung,Samsung S24 Ultra 256GB 12GB
Recib칤 el producto a tiempo y con todos los accesorios indicados como parte de la promoci칩n de introducci칩n del producto.,5,Samsung,Samsung S24 Ultra 256GB 12GB
"I have no complaints with this phone. It looks good, feels good and works well.",5,Samsung,Samsung S24 Ultra 256GB 12GB
Compre el producto hace un mes y es fant치stico aun no termino.,5,Samsung,Samsung S24 Ultra 256GB 12GB
Buen tel칠fono y buenas fotos. Me encanta usarlo siempre.,5,Samsung,Samsung S24 Ultra 256GB 12GB
"Compre este producto hace 2 meses y la verdad no esperaba que fuera tan bueno, realmente el punto que m치s destac칩 es la pantalla, es una pantalla que con su antireflejos cambia el juego completamente es una comodidad indescriptible y el brillo m치ximo de la pantalla cuando la luz del d칤a golpea hace que se vea perfectamente todo tipo de contenido, sin mencionar su resistencia mejorada a las rayones, estos dos meses ah tenido un par de roses y caidas y la pantalla esta completamente intacta es increible!!!!!. Soy estudiante universitario y me ah servido incre칤blemente para tomar notas, dibujar horarios, esquemas, etc, la bater칤a y su optimisasion hacen que dure todo el d칤a, la verdad no tengo quejas. En el apartado de las c치maras, tengo que ser sincero y la que menos me gusta es la c치mara de 50mp, es una c치mara que para paisajes es muy buena pero fotos de uno mismo no, ya que en su post procesado pinta las fotos muy amarillas, las c치maras de 12mp y de 200mp son completamente hermosas y no tengo quejas, aun lo que el post procesado amarillo de la c치mara de 50mp es bastante molesto, tambi칠n quisiera que samsung al fin aumente la carga r치pida m치s all치 de 45w, ya que aun que si es bastante veloz, se sigue quedando atr치s con otras marcas. Las funciones de IA son buenas pero aun les falta bastante trabajo para ser realmente 칰tiles, aun que ""circle and search"" de google es bastante ulti y realmente es una funci칩n muy buena. La nueva interfaz es extremadamente c칩moda y f치cil de manejar, realmente es un gama alta con un redim칤ento excepcional y que vale la pena cada centavo.",5,Samsung,Samsung S24 Ultra 256GB 12GB
"Compr칠 el telefono en febrero y no he tenido queja alguna, amo descubrir nuevos trucos de 칠l",5,Samsung,Samsung S24 Ultra 256GB 12GB
"Este equipo est치 brutal, de lo mejor que Samsung a podido lanzar",5,Samsung,Samsung S24 Ultra 256GB 12GB
"Nuevas funciones muy 칰tiles, la IA est치 excelente al momento de hacer fotograf칤a",5,Samsung,Samsung S24 Ultra 256GB 12GB
Compre el celular hace dos meses y todav칤a sigo sacando funciones nuevas,5,Samsung,Samsung S24 Ultra 256GB 12GB
"En rasgos generales est치 m치s que bien es un tel칠fono que no cualquiera le sacar치 provecho! Potente y r치pido, listo para cualquier trabajo exigente, ya te tenido otros topes pero este gana sin duda",5,Samsung,Samsung S24 Ultra 256GB 12GB
"Me gusta, pero al momento de formatearlo, se perdieron fant치stcas funciones en la camara",5,Samsung,Samsung S24 Ultra 256GB 12GB
"Lo tengo desde que sali칩, cada vez se actualiza para mejorar peque침os detalles, funcional 20/10, es incre칤ble.",5,Samsung,Samsung S24 Ultra 256GB 12GB
"Compre el telefono en Enero sin saber q era el ultimo galaxy es realmente increible lo q me gustaria que mejore es q las letras en los zoom 20, 30, 40 o 50 sean con mayor definicion",5,Samsung,Samsung S24 Ultra 256GB 12GB
"slim and symmetrical bezels, combine with a better and brighter display. Ridiculous battery life, note assists is awesome, the whole AI features are really top notch and make the phone a breeze to use. The camera is absurd specially with Raw expert. Overall a pretty amazing phone",5,Samsung,Samsung S24 Ultra 256GB 12GB
"Me encant칩 el S24, para mi es el mejor hasta ahora me fascina todas las funciones nuevas, lo f치cil que es manejarlo y lo funcional que me resulta, el color y dise침o gold el m치s bello",5,Samsung,Samsung S24 Ultra 256GB 12GB
Era lo que esperaba,5,Samsung,Samsung S24 Ultra 256GB 12GB
La bateria dura mucho,5,Samsung,Samsung S24 Ultra 256GB 12GB
Es una maquina fabulosa,5,Samsung,Samsung S24 Ultra 256GB 12GB
"Me he sentido c칩moda, aunque apenas lo estoy conociendo, solo tengo con el 3 d칤as. As칤 que luego les cuento mi experiencia",4,Samsung,Samsung S24 Ultra 256GB 12GB
"Vamos a hablar solo de la c치mara ya que todo lo dem치s llena las expectativas de un cliente exigente, sin embargo la introducci칩n de la IA en la fotograf칤a no es como la pintan, la edici칩n de Rematerizar y desenfocar ya lo ten칤an otros smartphone de Samsung como la Note10 plus. Y lo otro es que el zoom digital distorsiona mucho la imagen, y el estabilizador no lo encuentro, se activa autom치tico en zoom de 10x",4,Samsung,Samsung S24 Ultra 256GB 12GB
"Compre el tel칠fono hace tres d칤as. Es muy bueno, pero me parece quie la pantalla del s22 una ten칤a colores m치s n칤tidos, m치s llamativos pero ya me ir칠 acostumbrando.",4,Samsung,Samsung S24 Ultra 256GB 12GB
"No me termina de convencer faltan cosas a parte del cargador, auriculares, un boucher",4,Samsung,Samsung S24 Ultra 256GB 12GB
Bought it just less than a month still finding usage and applications also features on it most of all satisfied,4,Samsung,Samsung S24 Ultra 256GB 12GB
Bastante bueno es un Samsung aunq no s칠 si lo vale es casi lo mismo q el 23ultra jajaje,4,Samsung,Samsung S24 Ultra 256GB 12GB
"He usado mi tel칠fono 1 mes, y es genial pero siento que le falta a la c치mara quiz치 con la actualizaci칩n que har치n el procesamiento sea mejor eso espero ya que veo que el S23 ultra se ve mejor y compre el 24 por las camaras. Adicional soy de Guatemala y es una l치stima que no podamos tener acceso a goodlock, yo uso APK que no es lo mejor . Si pueden habilitarlo para mi pais se los agradecer칠.",4,Samsung,Samsung S24 Ultra 256GB 12GB
"Tube un peque침o inconveniente con mi clave y fue traumatico recuperarla, deverian dar un codigo PUK esclusivo de cada movil para uno poder recuperar su clave",4,Samsung,Samsung S24 Ultra 256GB 12GB
"Soy usuario Samsung desde el S22 Ultra y he renovado todos los a침os. Sent칤 el S23 Ultra mejor, con mayor rendimiento y menos calentamiento que el S24 Ultra.",4,Samsung,Samsung S24 Ultra 256GB 12GB
"Me encanta el dispositivo, excelente dise침o y durabilidad, qued칠 fascinado con ello Pero en la pantalla siento que hace falta color ya que tengo un S21 FE y se ve mucho mejor ah칤 la imagen incluso en mis juegos es donde me doy cuenta m치s tonalidad Incluso tambi칠n para tener todo las potentes componentes a칰n se traba en algunos juegos",4,Samsung,Samsung S24 Ultra 256GB 12GB
"El mes pasado adquir칤 el tel칠fono y me ha llenado en todos los aspectos, la c치mara es lo que m치s destaco pero s칠 que puede dar m치s, en mi opini칩n el sensor de 12 mpx queda a deber",4,Samsung,Samsung S24 Ultra 256GB 12GB
"Compr칠 este tel칠fono hace casi un mes, a pesar de que es un claro upgrade o mejora a la gama media de Samsung tampoco me ha sorprendido tanto. Le doy un 7/10, siento que me sali칩 muy caro y no sobrepas칩 las expectativas que ten칤a, es buen tel칠fono con una buena c치mara, buenas funciones pero todav칤a no han terminado de cumplir las expectativas que tenemos de nueva tecnolog칤a siento que no se ha introducido algo revolucionario y espero ese potencial que tienen logr칠 desarrollarse mejor",4,Samsung,Samsung S24 Ultra 256GB 12GB
Es muy buen celular pero el cambio ha sido m칤nimo del s23 ultra a este,4,Samsung,Samsung S24 Ultra 256GB 12GB
Me encanta todo lo 칰nico que me preocupa es que lei que las funciones de inteligencia artificial ser치n cobradas en unos a침os y por eso 4 estrellas,4,Samsung,Samsung S24 Ultra 256GB 12GB
"2 meses de uso el telefono. Utiliza 50% de bateria usandolo todo el dia, incluyendo carios juegos.",4,Samsung,Samsung S24 Ultra 256GB 12GB
compre el mes pasado.y ya calienta el aparato porque sera,4,Samsung,Samsung S24 Ultra 256GB 12GB
Pens칠 que la bater칤a ser칤a m치s potente pero para ser honestos a comparaci칩n de mi anterior tel칠fono el cual fue un xiaomi de bater칤a gama media alta este duraba igual o un poco m치s que este,4,Samsung,Samsung S24 Ultra 256GB 12GB
"Compr칠 el producto en la preventa. Se inform칩 vendr칤a con los Galaxy Buds 2 Pro y vino con los Buds 2 est치ndar. El celular es una maravilla, pero no cumplieron con lo prometido. Incluso hice el reclamo hace m치s de 1 mes, se me dijo me enviar칤an un correo para el cambio de aud칤fonos y lo sigo esperando. B치sicamente me hart칠 de esperar y tuve que abrir y usar los Buds 2 est치ndar a pesar de que no era lo que se me prometi칩. El S24 Ultra es una maravilla, fluido, buena c치mara, pantalla incre칤ble. El servicio de Samsung Costa Rica es p칠simo. No hay tiendas f칤sicas grandes, b치sicamente distribuidores. No cumplen con lo prometido, no se brinda la soluci칩n esperada por los de soporte.",4,Samsung,Samsung S24 Ultra 256GB 12GB
Veo la pantalla con unos tintes amarillentas sin yo tener el modo lectura,4,Samsung,Samsung S24 Ultra 256GB 12GB
Que tenga m치s amplitud en todas las apps y que el tel칠fono tiene que ser m치s sofisticado para la talla y precio,4,Samsung,Samsung S24 Ultra 256GB 12GB
"Como usuario de Samsung por muchos a침os, esperaba la llegada de este celular y cuando lo tuve, fue comp esperaba, muy bueno y feliz por tenerlo.",4,Samsung,Samsung S24 Ultra 256GB 12GB
"Compre el tel칠fono en febrero 24 y es genial, lo malo que no trae nada. Solo tel칠fono y cable. Para ser un tel칠fono tan caro deber칤an incluir m치s accesorios. La verdad los redmi, tecno, infinity le van ganando. Vienen con todo y son m치s econ칩micos",4,Samsung,Samsung S24 Ultra 256GB 12GB
Compre en enero el producto y he notado que se calienta mucho al usar algunas funciones como c치mara y aplicaciones de uso cotidiano.,4,Samsung,Samsung S24 Ultra 256GB 12GB
Al operarlo el mes pasado ya memdi cuenta que calienta mucho al utilizar funciones al m치ximo y su carga diaria dura poco en comparaci칩n al s23 ultra,3,Samsung,Samsung S24 Ultra 256GB 12GB
A lo mejor me termina de llamar la atencion y lo reviso a fondo y pienso que esta bueno,3,Samsung,Samsung S24 Ultra 256GB 12GB
"Cosas positivas: Excelente c치mara, bateria, pantalla, fluidez y m칠todos de desbloqueo. Cosas negativas: dispositivo bastante pesado y errores al utilizar android auto.",3,Samsung,Samsung S24 Ultra 256GB 12GB
"Me gusta lo que puedo hacer con ella, sus funciones me permiten hacer excelentes tomas",3,Samsung,Samsung S24 Ultra 256GB 12GB
La verdad la 칰nica diferencia con el s23 ultra es la pantalla as칤 que recomiendo que compren el s23 ultra qu칠 se van ahorrar bastante,1,Samsung,Samsung S24 Ultra 256GB 12GB
"춰Simplemente fant치stico! La evoluci칩n de la tecnolog칤a es realmente asombrosa. Es notable c칩mo la innovaci칩n constante trae consigo mejoras significativas. Cada nueva generaci칩n de dispositivos ofrece una experiencia renovada. Sin duda, la diferencia entre generaciones tecnol칩gicas puede ser abismal.",5,Samsung,Samsung S24 Ultra 256GB 12GB
"Compre el producto hace 5 dias y es fantastico!!!! me encanta, lo mejor.",5,Samsung,Samsung S24 Ultra 256GB 12GB
excelente producto celular de alta gama,5,Samsung,Samsung S24 Ultra 256GB 12GB
"Compre el producto hace unos 3 meses ya, no le veo cosas negativas, es excelente en todo, c치mara, pantalla, rendimiento, bater칤a, muy buena calidad de construcci칩n muy premium,excelente para trabajos de creaci칩n de contenidos y trabajos de turismo etc por la ia con traducciones en tiempo real etc",5,Samsung,Samsung S24 Ultra 256GB 12GB
Compre este producto hace una semana y estoy sin palabrad,5,Samsung,Samsung S24 Ultra 256GB 12GB
"Este tel칠fono es lo m치ximo, full recomendado, digan lo que digan, este es el mejor Tel칠fono del 2024. Excelente C치mara, excelentes funciones.",5,Samsung,Samsung S24 Ultra 256GB 12GB
"Compre el producto hace unos 3 meses ya, no le veo cosas negativas, es excelente en todo, c치mara, pantalla, rendimiento, bater칤a, muy buena calidad de construcci칩n muy premium,excelente para trabajos de creaci칩n de contenidos y trabajos de turismo etc por la ia con traducciones en tiempo real etc",5,Samsung,Samsung S24 Ultra 256GB 12GB
Compre este producto hace una semana y estoy sin palabrad,5,Samsung,Samsung S24 Ultra 256GB 12GB
"Este tel칠fono es lo m치ximo, full recomendado, digan lo que digan, este es el mejor Tel칠fono del 2024. Excelente C치mara, excelentes funciones.",5,Samsung,Samsung S24 Ultra 256GB 12GB
"Un excelente tel칠fono, funciones de ayuda muy buenas y excelentes c치mara, colores n칤tidos en pantalla y buena iluminaci칩n a exposici칩n del sol, facilidad de uso del tel칠fono.",5,Samsung,Samsung S24 Ultra 256GB 12GB
Me a gustado mucho en especial la C치mara que es brutal y su funci칩n x100,5,Samsung,Samsung S24 Ultra 256GB 12GB
"Mi esposo me compr칩 칠ste celular hace 1 mes y no puedo explicar lo mucho que me ha servido, estudio un t칠cnico en asistente contable, tengo que hacer res칰menes y estudiar todas las semanas constantemente as칤 que se me hace incre칤ble lo f치cil que es usar la AI, las fotos aunque no las tome un profesional salen lindisimas, muy satisfecha con este tel칠fono la verdad",5,Samsung,Samsung S24 Ultra 256GB 12GB
"Un mes de adquirido y me sorprendo cada d칤a por las funciones y capacidades del Samsung Galaxy S24 Ultra, entre ellas su c치mara, que hasta toma fotograf칤as de cuerpos celestes que compiten con mi telescopio!",5,Samsung,Samsung S24 Ultra 256GB 12GB
Tengo este tel칠fono hace 2 meses y esta incre칤ble.,5,Samsung,Samsung S24 Ultra 256GB 12GB
"Lo compre desde el lanzamiento, estaba esperando uno con pantalla plana. He notado el cambio del s22 al s24.",5,Samsung,Samsung S24 Ultra 256GB 12GB
"El mejor telefono del planeta, es lo mejor que pudo haber hecho Samsung",5,Samsung,Samsung S24 Ultra 256GB 12GB
Me encant칩 la entrega a tiempo y las gran cualidades que trae mi nuevo s24 es el primero que tengo y no tengo queja alguna,5,Samsung,Samsung S24 Ultra 256GB 12GB
Lo compre y lleno mi expectativa con su realidad virtual,5,Samsung,Samsung S24 Ultra 256GB 12GB
"Lo tengo desde enero y es una maravilla, accesibilidad y funciones mejoradas con la AI.",5,Samsung,Samsung S24 Ultra 256GB 12GB
"Compre este articulo, el mes pasado y me gusta para ver mis series favoritas",5,Samsung,Samsung S24 Ultra 256GB 12GB
"Incre칤ble celular con el que puedes hacer un mill칩n de cosas, la bater칤a te permite salir sin miedo a que se descargue me dura m치s de un d칤a con bastante uso, c치mara incre칤ble y ni que hablar de la pantalla y su dise침o sobrio y hermoso",5,Samsung,Samsung S24 Ultra 256GB 12GB
"Compre este producto y me encanta , muy buenas fotos",5,Samsung,Samsung S24 Ultra 256GB 12GB
Compre el mes pasado y es una experiemcia unica. Espacio y calidad con fluidezy rapidez,5,Samsung,Samsung S24 Ultra 256GB 12GB
"Compre el galaxy S24 ultra, hace un mes y a칰n no he explorado todas sus funciones, cada d칤a me sorprende con algo nuevo 춰es lo m치ximo!",5,Samsung,Samsung S24 Ultra 256GB 12GB
Compre hace 2 meseskssjxjxhwowksbxjxxbsnjwwjqkssjxnbsbwnsnxnd,5,Samsung,Samsung S24 Ultra 256GB 12GB
"Me encanta todo del s24 ultra, la calidad de la c치mara es incre칤ble, el tacto al sostener el tel칠fono es agradable, no me canso de usar el s pen. La bater칤a dura demasiado sin importar la calidad de video de la pantalla.. el procesador es muy potente.. En fin Me encanta lo conservar칠 por muchos an팯os.",5,Samsung,Samsung S24 Ultra 256GB 12GB
Un mes con el dispositivo y va de locos. Todo corre de la manera perfecto. Ning칰n problema.,5,Samsung,Samsung S24 Ultra 256GB 12GB
Adquir칤 este producto realmente pq es lo 칰ltimo que sali칩 pero actualmente estoy enamorada de mi equipo y no lo cambiar칤a por nada. Me encantan todas las funciones,5,Samsung,Samsung S24 Ultra 256GB 12GB
"Lo compre para grabar y editar, excelente bater칤a.",5,Samsung,Samsung S24 Ultra 256GB 12GB
"Llevo un mes y me a parecido fascinante su velocidad de desbloqueo con la huella, el refresco de la pantalla super fluido y la c치mara de envidia para la competencia de dispositivo de la misma gama.",5,Samsung,Samsung S24 Ultra 256GB 12GB
Compr칠 el equipo hace como 2 meses y me encanta. Las funciones con el lapiz son muy buenas y tiene una camara excelente. Ademas no tener la pantalla curva es mucho mejor.,5,Samsung,Samsung S24 Ultra 256GB 12GB
Soy usuario de samsung desde el galaxy s 1 y de el note desde el 5 y el ultra 24 me sorprendio. 1. Pantalla impecable el brillo y que no refleja casi es genial. 2.vengo de un ultra 22 y la diferencia en el uso de la bater칤a es abismal.con el ultra puedo estar un dia completo de uso sin necesidad de cargar. 3.Me encanta que la pantalla sea completamente plana. 4. Su c치mara es incomparable.,5,Samsung,Samsung S24 Ultra 256GB 12GB
"Excelentes c치maras, funciones de edici칩n de fotos y videos que sorprenden",5,Samsung,Samsung S24 Ultra 256GB 12GB
"Tengo 6 meses con el tel칠fono y no puedo estar m치s conforme. Excelente camara, excelente bater칤a, y performance.",5,Samsung,Samsung S24 Ultra 256GB 12GB
Muy bueno de verdad 游녨 me a funcionado excelente 游녧,5,Samsung,Samsung S24 Ultra 256GB 12GB
"Excelencia, para mis necesidades, el dispositivo las cumple todas al 100%.",5,Samsung,Samsung S24 Ultra 256GB 12GB
"El mejor telefono que he usado en mi vida , simplemente 10 de 10.",5,Samsung,Samsung S24 Ultra 256GB 12GB
"El celular es hermoso, tal cual a la imagen, su tama침o es grande, pero c칩modo para tomar.",5,Samsung,Samsung S24 Ultra 256GB 12GB
"Tama침o perfecto, excelente c치mara, muy buenas celular",5,Samsung,Samsung S24 Ultra 256GB 12GB
"El s24 ultra a d칤a de hoy es lo mejor de Android un verdadero tit치n tope de gama . Pantalla , procesador,camara , autonom칤a personalizaci칩n y adem치s el spen es un plus a considerar",5,Samsung,Samsung S24 Ultra 256GB 12GB
Cumple con todos los requerimientos que se necesitan,5,Samsung,Samsung S24 Ultra 256GB 12GB
"Muy buen celular tiene muy buena pantalla, muy buenas c치maras y buen material de construcci칩n.",5,Samsung,Samsung S24 Ultra 256GB 12GB
"muy r치pido, fotos de super alta definici칩n, no se pega ni se calienta",5,Samsung,Samsung S24 Ultra 256GB 12GB
Muy buenas fotos .. buenisimo en todo,5,Samsung,Samsung S24 Ultra 256GB 12GB
Lo mejor de lo mejor. Una camara super profesional y mega rapido en todas sus funciones . Recomendado,5,Samsung,Samsung S24 Ultra 256GB 12GB
Tengo 2 dias con el telefono y me gusta mucho se nota mucho la diferencia de aplicaciones rendimiento y la camara es expectacular,5,Samsung,Samsung S24 Ultra 256GB 12GB
Me encanta un equipo que cumple todas mis necesidades,5,Samsung,Samsung S24 Ultra 256GB 12GB
"Vengo de un S22 ultra, y se siente la mejor칤a con el tel칠fono, encantado con la pantalla antirreflejos y una bateria con igual capacidad pero m치s duraci칩n",5,Samsung,Samsung S24 Ultra 256GB 12GB
Acabo de comprar y me encanta cada una de sus funciones que facilitan m치s el trabajo.,5,Samsung,Samsung S24 Ultra 256GB 12GB
"Lo compre el mes de julio, sin duda alguna un buen celular vale el costo del producto",5,Samsung,Samsung S24 Ultra 256GB 12GB
"Me gusta, es un bonito tel칠fono de calidad,,elegante",5,Samsung,Samsung S24 Ultra 256GB 12GB
Compre este producto hace una semana y me parece muy bueno un procesador excelente,5,Samsung,Samsung S24 Ultra 256GB 12GB
Compre este producto hace 5 dias y me tiene maravillado,5,Samsung,Samsung S24 Ultra 256GB 12GB
"3 d칤as de estar usando el producto, incre칤ble. 칔nico punto a mejorar su c치mara, pedir칤a m치s nitidez",5,Samsung,Samsung S24 Ultra 256GB 12GB
E comprado este producto y estoy fascinado es el mejor,5,Samsung,Samsung S24 Ultra 256GB 12GB
"Este tel칠fono es la mejor compra que he realizado, vale cada peso pagado. Gracias!!",5,Samsung,Samsung S24 Ultra 256GB 12GB
"Es una belleza de telefono en velocidad, camara, estilo, sonido es un telefono completo.",5,Samsung,Samsung S24 Ultra 256GB 12GB
Excelentes funciones de c치mara soy fan Samsung y ame el Zflip 5 pero la Galaxy S24 Ultra es super nice! Poner la c치mara lenta al tocar el video es super util,5,Samsung,Samsung S24 Ultra 256GB 12GB
Am칠 el dise침o y calidad,5,Samsung,Samsung S24 Ultra 256GB 12GB
Lo mejor es la c치mara 200mp y s-pen,5,Samsung,Samsung S24 Ultra 256GB 12GB
"Excelente pantalla buena calidad y su funcion antireflejos es espectacular, su muy buena camara y su procesador para las tareas del dia a dia y juegos",5,Samsung,Samsung S24 Ultra 256GB 12GB
Acabo de comprarme este celular y me ha resultado genial,5,Samsung,Samsung S24 Ultra 256GB 12GB
R치pido y bueno y por ahora no e tenido inconvenientes,5,Samsung,Samsung S24 Ultra 256GB 12GB
Tengo el color azul o celeste y me encanta esta hermosoooo,5,Samsung,Samsung S24 Ultra 256GB 12GB
"Recib칤 el equipo el pasadi mi칠rcoles 10 de julio y todav칤a estoy a침adiendo funciones. Este modelo es realmenre excelente y le recomiendo como upgrade definitivo de cualquier smartphone. Es un mundo de posibilidades y alternativas en sus nuevas funciones, esoecialmente la IA.",5,Samsung,Samsung S24 Ultra 256GB 12GB
"En realidad no deja de sorprender, aprendiendo cada d칤a m치s del uso del tel칠fono ya que de 칠l s22ultra pase a este nuevo s24ultra",5,Samsung,Samsung S24 Ultra 256GB 12GB
"Igual a las caracter칤sticas detalladas, r치pido, c칩modo y f치cil de usar",5,Samsung,Samsung S24 Ultra 256GB 12GB
"es un excelente celular en todo sentido, tiene unas c치maras extraordinarias una bater칤a de larga duraci칩n excelente, una fluidez m치xima para juegos archivos o RRSS y la IA lo hace aun mas espectacular, 1000% recomendado.",5,Samsung,Samsung S24 Ultra 256GB 12GB
"Sencillamente me encanta!!! Excelente dise침o, excelente pantalla y rendimiento de bater칤a! S칰per n칤tido, maravilloso Zoom! La IA es lo m치ximo!!!",5,Samsung,Samsung S24 Ultra 256GB 12GB
Tama침o real y de facil manejo muy comodo sobretodo con su spen,5,Samsung,Samsung S24 Ultra 256GB 12GB
Muy conforme con mi compra.,5,Samsung,Samsung S24 Ultra 256GB 12GB
"es un tremendo smartphone, el mejor del mercado sin duda.",5,Samsung,Samsung S24 Ultra 256GB 12GB
Buen칤simo el producto,5,Samsung,Samsung S24 Ultra 256GB 12GB
Cumple con las caracter칤sticas indicadas,5,Samsung,Samsung S24 Ultra 256GB 12GB
"Muy buen comportamiento, como me tiene acostumbrado Samsung. Se siente solidez, tanto en hardware como en software.",5,Samsung,Samsung S24 Ultra 256GB 12GB
"Excelente celular, cumpli칩 con todas mis expectativas, es muy bello el color tal cual a la foto. Lo recomiendo totalmente",5,Samsung,Samsung S24 Ultra 256GB 12GB
"La verdad que me lo compre por que se me haberlo el otro celular que tenia pero no me quiso que en ning칰n momento en elegir este celular ya que me brinda muchas herramientas que con mi otro galaxy no tenia , me siento muy contento y orgulloso de haber realizado esta compra. 춰Que viva Samsung!",5,Samsung,Samsung S24 Ultra 256GB 12GB
"Compre este equipo hace solo 3 d칤as y esta genial, su bater칤a, dise침o y su AI todo me encanta.",5,Samsung,Samsung S24 Ultra 256GB 12GB
"Lleg칩 bien, en el tiempo acordado y funciona perfecto Es igual a la imagen La bater칤a me dura el d칤a completo e incluso m치s (con harto uso)",5,Samsung,Samsung S24 Ultra 256GB 12GB
"Todo excelente, pero como usuarios deberiamos merecer regalos en agradecimiento a su pteferencia",5,Samsung,Samsung S24 Ultra 256GB 12GB
this product is amazing. I love the camera quality and options. Truly an awesome phone,5,Samsung,Samsung S24 Ultra 256GB 12GB
"Se nota que la serie Ultra de Samsung es superior a la competencia, incluso superior a IPhone 15 pro max, el S24 ultra es un tel칠fono de alta gama que da mucho prestigio, Solamente lo usamos personas decentes y de alto poder adquisitivo,no como IPhone que todos los rotos flaites usan para ""darle corte"" seg칰n ellos.",5,Samsung,Samsung S24 Ultra 256GB 12GB
"Buen equipo, Rafa P칠rez y su excelente c치mara.",5,Samsung,Samsung S24 Ultra 256GB 12GB
Cumplio mi expectativas,5,Samsung,Samsung S24 Ultra 256GB 12GB
Ya tengo un mes de tenerlo y no me arrepiento fue la mejor opci칩n,5,Samsung,Samsung S24 Ultra 256GB 12GB
Es el mejor Samsung que he tenido y puedo hacer muchas cosas diferentes con toda la tecnologia AI,5,Samsung,Samsung S24 Ultra 256GB 12GB
Me gusta la aplicaci칩n porque protege todo 1111111111,5,Samsung,Samsung S24 Ultra 256GB 12GB
"M치s r치pido mejor calidad de pantalla,mejor calidad de imagen y fotos",5,Samsung,Samsung S24 Ultra 256GB 12GB
Este tel칠fono forma parte de mi trabajo y cumple mis expectativas a cabalidad,5,Samsung,Samsung S24 Ultra 256GB 12GB
"buen producto, cumple con lo informado a detalle",5,Samsung,Samsung S24 Ultra 256GB 12GB
Lo compr칠 el 22 de enero y estoy feliz con este m칩vil.,5,Samsung,Samsung S24 Ultra 256GB 12GB
Su c치mara es incre칤ble lo compre en marzo y no me arrepiento,5,Samsung,Samsung S24 Ultra 256GB 12GB
Muy buen tel칠fono con buenas funciones y muy productivo buena respuesta de uso,5,Samsung,Samsung S24 Ultra 256GB 12GB
Compre mi tel칠fono hace m치s o menos 2 meses es excelente 游녧,5,Samsung,Samsung S24 Ultra 256GB 12GB
Es un excelente tel칠fono sobre todo con la inteligencia artificial,5,Samsung,Samsung S24 Ultra 256GB 12GB
Soy Galaxy Team y siempre he usado los S ultra cada vez me sorprende m치s la tecnolog칤a que Samsung incorpora en estos dispositivos.,5,Samsung,Samsung S24 Ultra 256GB 12GB
